,year,title_cn,author_cn
80,2023,加强半导体基础能力建设 点亮半导体自立自强发展的“灯塔”,
81,2023,油气安全战略与“双碳”战略：关系与路径,
82,2023,2023年中国经济增长速度的预测分析与政策建议,
83,2023,《2022研究前沿》——11个大学科领域发展趋势与重点研究问题,
84,2023,《2022技术聚焦》——20个高影响力专利技术焦点分析解读,
85,2023,碳中和目标下中国新能源使命,
86,2023,美国联邦政府资助和管理阿尔茨海默病研究项目的实践与启示,
87,2023,新形势下我国能源高质量发展与能源安全,
88,2023,国际动荡局势对我国能源资源安全的挑战与应对策略,
89,2023,我国煤炭主体能源安全高质量发展的理论技术思考,
90,2023,构筑基于“三线整合”的中国滨海湿地生态安全格局,
91,2023,稀土产业链全球格局现状、趋势预判及应对战略研究,
92,2023,可持续发展目标视野下中国食物系统转型的战略思考,
93,2023,新形势下科技体制改革攻坚的若干思考,
94,2023,国家创新体系的发展演进分析与若干思考,
95,2023,人工智能驱动的科学研究新范式：从AI4S到智能科学,
96,2023,黄土高原生态保护和高质量发展现状、问题与建议,
97,2023,重组后的全国重点实验室科技经费配置政策研究,
98,2023,太湖鼋头渚（奚和平 摄影）,
99,2023,中国盐穴型战略石油储备库建设的问题及对策,
100,2023,构建科技预算绩效评价3E理论，促进科技投入效能提升,
101,2023,跨国油气勘探开发在保障国家能源安全中的作用,
102,2023,生物乙醇重整制氢技术挑战与产业化发展机遇,
103,2023,美国新型类DARPA项目管理创新机构的若干进展及启示,
104,2023,转变财政科技经费配置管理方式，提升科技投入效能,
105,2023,页岩油开发利用及在能源中的作用,
106,2023,高水平科技自立自强下我国集成电路人才培养“痛点”与对策,
107,2023,GPT技术变革对基础科学研究的影响分析,
108,2023,美国“脑计划”实施特点分析及启示,
109,2023,中国科学院研究所整体预算绩效评价试点的实践与思考,
110,2023,美国联邦政府科技预算绩效评价的发展演变与启示,
111,2023,机器人超精密智能研抛装备,
112,2023,中国西北干旱区水资源与生态环境变化及保护建议,
113,2023,英国碳中和战略政策体系研究与启示,
114,2023,中国东部超大城市群生态环境建设成效与发展对策,
115,2023,国家有组织科研：迎接世界三大中心转移的中国创新生态系统探讨,
116,2023,海洋负排放——基于地球系统科学思维的海洋科技变革,
117,2023,国际社交媒体平台上的中国科学形象研究——基于推特平台的数据,
118,2023,“欧盟半导体危机”的成因、对策与启示——围绕《欧洲芯片法案》的解读,
119,2023,海洋生态保护修复：国际议程与中国行动,
120,2023,中国跨越“中等技术陷阱”的策略研究,
121,2023,科学基金助力女性科研人员成长：政策、成效与展望,
122,2023,关于粤港澳大湾区一体化生态保护修复的思考与建议,
123,2023,工业生产全过程减污降碳：方法策略与科学基础,
124,2023,中国山地保护与山区发展：回顾与展望,
125,2023,打赢“三北”攻坚战，再造一个“新三北”：实现路径与战略规划,
126,2023,目录,
127,2023,中国特色新型科技智库建设研究——基于系统工程和科学传播等视角,
128,2023,开放科学环境下全球科技期刊的发展态势,
129,2023,快讯：2021年度《中国科学院院刊》“领跑者5000（F5000）”入选论文,
130,2023,人工智能新近发展及其对经济学研究范式的影响,
131,2023,中国能源发展战略研究,
132,2023,碳中和背景下我国典型战略性金属中长期可持续供给路径,
133,2023,美国建设生物医药创新高地的实践及对我国的启示,
134,2023,中国湿地保护修复成效及发展策略,
135,2023,抢占“镓体系”半导体科技制高点 助力实现光电子信息产业的率先突破,
136,2023,中国与美国、日本、德国制造业国际竞争优势比较研究及相关政策建议,
137,2023,我国生物种业发展现状与问题,
138,2023,新时代城市空间结构变革与转型,
139,2023,深刻认识科技安全与经济安全互动关系 建立科技安全监测预警体系,
140,2023,政策速览（2022年12月）,
141,2023,《中国科学院院刊》印迹2022,
142,2023,欢迎订阅《中国科学院院刊》,
143,2023,气候变化心理学研究进展及发展建议,
144,2023,侯建国2023年新年贺词,
145,2023,大国治理：中国荒漠化防治的战略选择与未来愿景,
146,2023,《中国科学院院刊》“2022年度优秀编委”“2022年度优秀审稿人”和“2021年度优秀论文”,
147,2023,河西走廊绿洲生态建设和农业发展的若干思考与建议,
148,2023,中美技术摩擦给我国高技术产业和企业带来的风险分析,
149,2023,深化科教融合，培养未来科技领军人才,
150,2023,复兴路上的科学家精神：新时代·新青年——邹文秀：把最美芳华献给黑土地,
151,2023,海岸带蓝碳增汇：理念、技术与未来建议,
152,2023,咸海生态治理：深化与中亚科技合作的重要路径,
153,2023,印度数据本地化的范式评述及其对中国的启示,
154,2023,颠覆性技术驱动的未来产业培育模式与路径研究——美国布局下一代集成电路产业的启示,
155,2023,“一带一路”科技创新人才培养：中国优势、挑战与关键路径,
156,2023,从战略性新兴产业到未来产业：新方向、新问题、新思路,
157,2023,新时代创新人才成长路径及所需环境,
158,2023,征稿简则,
159,2023,国际发展环境变化与我国科技战略选择：历史回顾与未来展望,
160,2023,大科普战略背景下院士群体科普实践的思考与建议,
161,2023,从边界层到中高层大气的气候环境综合探测与科学研究,
162,2023,加快推进生物安全能力建设，全力保障国家生物安全,
163,2023,人工智能伦理的国际软法之治：现状、挑战与对策,
164,2023,“一带一路”生态环境保护和可持续发展科技合作重点领域,
165,2023,系统观下的“一带一路”生命健康之路建设,
166,2023,我国开放科学政策体系构建研究,
167,2023,RCEP缔约国数据跨境流动政策的数字生产力基础及其影响——以数字融合指数为参照,
168,2023,科技创新与合作支撑“一带一路”高质量发展,
169,2023,中国湖泊生态环境变化与保护对策,
170,2023,加强开放数据基础设施建设，推动开放科学发展,
171,2023,复兴路上的科学家精神：新时代·新青年——刘焕军：勇挑重担，投身黑土地监测与保护事业,
172,2023,河西走廊—塔克拉玛干沙漠边缘阻击战：风沙形势与防治任务,
173,2023,构建乡村社会心理服务体系助力乡村振兴战略,
174,2023,"中国农田非CO,2,温室气体减排的研究现状与建议",
175,2023,战略科学家典型特征量化评估：探索与实证研究,
176,2023,适应“昆明—蒙特利尔全球生物多样性框架”目标的中国海洋保护区政策研究,
177,2023,加快完善支持企业基础研究的政策体系,
178,2023,乌克兰危机下的全球能源格局变化及能源科技发展新特点,
179,2023,科技预算绩效评价的理论与实践,
180,2023,中国式现代化的分层结构和三个建议,
181,2023,新型能源体系建设的背景形势、策略建议和未来展望,
182,2023,发挥学部智库咨询作用，服务国家“双碳”战略需求——中国科学院学部“碳中和”重大咨询项目案例,
183,2023,目录,
184,2023,构筑开放科学行动路线图 把握开放科学发展机遇,
185,2023,车载双光路污染气体分布及网格化排放遥测系统,
186,2023,《中国科学院院刊》新媒体,
187,2023,我国技术供给安全的影响因素及作用机制,
188,2023,新时代科研范式变革的内涵及应对,
189,2023,欢迎订阅《中国科学院院刊》,
190,2023,关于实施大科普战略的法治保障研究,
191,2023,持续推进反刍家畜全生命周期营养工程的创新与发展,
192,2023,日本科技领域是否存在“举国体制”——以半导体技术攻关为考察对象,
193,2023,服务国家战略需求 培养拔尖创新人才——中国科学院大学科教融合办学的制度逻辑与发展实践,
194,2023,气候变化的生态影响及适应对策,
195,2023,“一带一路”共建国家低碳转型路径研究与气候合作建议,
196,2023,面向开放科学的元出版理念与平台建设实践,
197,2023,“数字丝路”建设的科技创新研究,
198,2023,“一带一路”科技合作支撑青藏高原区域发展的实践与建议,
199,2023,美日“先进存储研究联合体”发展路径与启示,
200,2023,加强国家科普能力建设，服务新时代国家战略需求,
201,2023,德国生物圈保护区发展经验及对中国的建议,
202,2023,政策速览（2023年1月）,
203,2023,靶斑仪,
204,2023,技术科学的学科体系、学术体系与话语体系,
205,2023,抓住数字技术与数字经济发展新机遇，不断提升城市科学研究水平,
206,2023,基于生物地球化学循环视角下我国农业碳达峰、碳中和应对策略,
207,2023,发展长穗偃麦草，建设“滨海草带”,
208,2023,海上风能等级区划研究：瓶颈与对策,
209,2023,我国银行业技术创新发展的问题分析与建议,
210,2023,未来技术风险识别框架研究——基于技术经济安全视角,
211,2023,城市科学研究的新机遇,
212,2023,无液氦稀释制冷机,
213,2023,大型平行光管,
214,2023,“一带一路”科技创新合作现状、挑战与发展方向,
215,2023,破解“卡脖子”技术难题：“情境—策略”非对称匹配视角,
216,2023,我国开放科学治理框架研究,
217,2023,400毫米口径光学望远镜,
218,2023,高质量共建“一带一路”加快构建“双循环”新发展格局,
219,2023,关于科技创新赋能我国产业高质量发展的若干思考,
220,2023,构建面向未来产业的创新生态系统：结构框架与实现路径,
221,2023,目录,
222,2023,新任命的中国科学院副院长、党组成员常进简介,
223,2023,绿色丝绸之路建设的气候变化科技应对战略,
224,2023,“一带一路”共建国家气候变化的技术需求评估及推动南南技术合作的政策建议,
225,2023,“一带一路”灾害风险协同管理国际合作机制探究,
226,2023,加强企业基础研究能力，弥补国家创新体系短板,
227,2023,质子重离子治癌及QA探测器,
228,2023,技术经济安全：研究重点、演化机理和评估框架,
229,2023,中国特色世界一流大学建设是教育、科技、人才一体化部署的有效实践——以中国科学技术大学为例,
230,2023,面向碳中和的“一带一路”气候变化主要特征与灾害风险研究,
231,2023,“一带一路”科技聚焦,
232,2023,改进中国科研制度和研发体系的“双轨制”构想,
233,2023,加强基础研究 夯实科技自立自强根基,
234,2023,关于信息技术驱动未来产业的若干思考,
235,2023,新冠疫情后北欧主要国家创新战略与政策比较研究——基于建设创新高地的视角,
236,2023,小动物能谱显微CT,
237,2023,基于“物理—事理—人理”的多源异构大数据融合探究,
238,2023,从政策推动到研究产出——浅析医院主导人工智能研究的技术性挑战,
239,2023,创新型研究型大学新在何处？——以上海科技大学的实践探索为例,
240,2023,兆瓦级大功率等离子体炬,
241,2023,相对磁场方向测量磁力显微镜,
242,2023,“一带一路”科技合作新格局构建研究,
243,2023,趋势观察：精准医学领域发展态势分析,
244,2023,活体脑化学物质实时分析系统,
245,2023,旗形光学面形仪,
246,2023,微纳能谱CT,
247,2023,液氮温区一体式制冷机,
248,2023,政策速览（2023年4—5月）,
249,2023,数字经济赋能中国式现代化建设,
250,2023,超强超短激光器,
251,2023,毒品快速检测仪,
252,2023,2022年度中国科学十大进展简介,
253,2023,林火碳排放的影响与减缓对策,
254,2023,科学级光学望远镜,
255,2023,基于万物互联网的泛在操作系统开源生态构建方法研究,
256,2023,新任命的中国科学院副院长、党组成员丁赤飚简介,
257,2023,喜马拉雅山区大气与环境综合观测研究支撑青藏高原地球系统科学发展,
258,2023,硬X射线大视场高分辨高性能成像探测器,
259,2023,技术经济安全理论与实践,
260,2023,关于科学普及与中国未来发展的思考,
261,2023,编者按,
262,2023,钙离子光钟,
263,2023,复兴路上的科学家精神：新时代·新青年——张丽莉：“玩泥巴”的女博士,
264,2023,多功能内耗仪,
265,2023,政策速览（2023年2月）,
266,2023,“一带一路”的实践探索——对江苏、浙江、广东的调查,
267,2023,建设世界科技强国的驱动逻辑、关键路径与中国突破——基于英德美建设世界科技强国的历史考察,
268,2023,系列氦质谱检漏仪,
269,2023,多模态嵌入式荧光导航聚焦离子束减薄扫描电镜系统,
270,2023,深海多通道拉曼光谱探测系统,
271,2023,复兴路上的科学家精神：新时代·新青年——陈海华：谁说搞计算机的就搞不了农业,
272,2023,“大科普战略内涵与实施研究”专题 序言,
273,2023,“一带一路”共建国家应对气候变化合作战略及对策建议,
274,2023,城市化地区实体与流空间演变及高质量发展路径分析,
275,2023,便携式伽玛射线成像仪,
276,2023,人体肺部气体磁共振成像仪,
277,2023,国际大科学计划灾害风险综合研究十年回顾与展望,
278,2023,聚焦“创新赋能高质量发展”《中国科学院院刊》编委会特别活动——“2023松山湖科学对话”,
279,2023,风险投资如何助力中国科技创新,
280,2023,激光位移传感器,
281,2023,水体藻类在线/原位监测仪,
282,2023,复兴路上的科学家精神：新时代·新青年——中国科学院工程热物理研究所吴仲华高效低碳燃气轮机科技攻关青年突击队：聚成一团火，点亮燃气轮机自主研发的方向,
283,2023,高能脉冲磁控溅射镀膜机,
284,2023,深海海底理化环境长期观测系统,
285,2023,复兴路上的科学家精神：新时代·新青年——中国科学院物理研究所严济慈超导量子计算攻关突击队：面向国家重大需求，抢占量子科技高地,
286,2023,强化珠江流域生态保护与绿色发展 助力粤港澳大湾区建设,
287,2023,如何改进中国纯基础研究系统,
288,2023,目录,
289,2023,星载铷原子钟,
290,2023,窄线宽激光器,
291,2023,钨灯丝扫描电子显微镜,
292,2023,伽玛射线成像仪,
293,2023,扩展内容,
294,2023,建设世界科技强国,
295,2023,钨灯丝扫描电子显微镜,
296,2023,2.7—3微米中红外激光晶体元件,
297,2023,轮廓测量仪,
298,2023,牛顿环®智能化电阻点焊装备,
299,2023,中国中等技术现状分析,
300,2023,激光跟踪仪,
301,2023,麻醉深度在线监护仪,
302,2023,封面,
303,2023,政策速览（2023年3月）,
304,2023,中国芯片产业如何跨越“中等技术陷阱”？,
305,2023,中子斩波器,
306,2023,天光背景测量仪,
307,2023,目录,
308,2023,开放科学发展趋势与治理策略,
309,2023,深紫外激光光致发光光谱仪,
310,2023,等离子体化学气相沉积镀膜设备,
311,2023,基础研究类科研机构评估：德国马普学会的实践与启示,
312,2023,复兴路上的科学家精神：新时代·新青年——廖晓勇：“揭榜挂帅”，为黑土地保护 利用打造系统解决方案,
313,2023,可搬运光钟,
314,2023,电子束蒸发镀膜设备,
315,2023,温室气体柱总量地基观测系统,
316,2023,太阳辐射计,
317,2023,高精度多材料生物3D打印设计制造平台,
318,2023,病原微生物原位即时检测移动基站,
319,2023,《中国科学院院刊》新闻记者证年度核验人员名单公示,
320,2023,习近平给“科学与中国”院士专家代表回信 强调带动更多科技工作者支持和参与科普事业 促进全民科学素质的提高,
321,2023,目录,
322,2023,“一带一路”共建国家应对气候变化国际合作经验借鉴及启示,
323,2023,东亚经济体成功跨越“中等技术陷阱”的经验,
324,2023,低温强磁场用扫描探针显微镜,
325,2023,瞬态光电压光电流光谱仪,
326,2023,反光电子能谱仪,
327,2023,地面电磁探测系统,
328,2023,我国未来产业科技发展战略选择,
329,2023,低温热导率测试仪,
330,2023,六氟化硫气体分解产物质谱检测仪,
331,2023,超快位敏型微通道板型光电倍增管,
332,2023,湍流激光雷达,
333,2023,华北香河气候与环境综合野外科学观测研究站,
334,2023,全自动比表面及孔径分析仪,
335,2023,光纤通信链路故障检测仪,
336,2023,高精度在线测氨仪器,
337,2023,美丽中国“35目标”和“50愿景”情景模拟,
338,2023,超导加速器在线等离子体清洗装置,
339,2023,高能衍射仪,
340,2023,气相团簇反应与质谱检测和软沉积系统,
341,2023,大面积紫外光刻机,
342,2023,欢迎订阅《中国科学院院刊》,
343,2023,大气臭氧观测激光雷达,
344,2023,流式细胞仪上样前细胞总量质控仪,
345,2023,分布式自主科学：科学多样可持续性发展的新范式,
346,2023,三重四极杆质谱仪,
347,2023,刍议科普现代化的本质特征与建构路径,
348,2023,新任命的中国科学院副院长、党组成员汪克强简介,
349,2023,“一带一路”油气勘探开发合作成果与展望,
350,2023,深紫外激光光发射电子显微镜,
351,2023,激光雷达望远镜,
352,2023,腔增强反照率光谱仪,
353,2023,欢迎订阅《中国科学院院刊》,
354,2023,仪器分子泵,
355,2023,多维力/力矩传感器,
356,2023,拉曼单细胞分选仪,
357,2023,面向人民生命健康，提升国家医学科技整体能力,
358,2023,以科学为基础的技术创新与产业演化的动力机制研究——以半导体、数字计算机及无线电技术为例,
359,2023,企业如何通过开放实现技术进步,
360,2023,关于税制改革赋能我国数字经济国际竞争力提升的若干思考,
361,2023,多相反应器内非均相特性测量系统,
362,2023,小型绝对重力仪,
363,2023,跨越“中等技术陷阱”：区域科创高地的角色与作用,
364,2023,场发射扫描电子显微镜,
365,2023,系列化深紫外全固态激光器,
366,2023,系列真空泵,
367,2023,大气相干长度仪,
368,2023,高速多通道数据采集卡,
369,2023,欢迎订阅《中国科学院院刊》,
370,2023,《中国科学院院刊》新媒体,
371,2023,目录,
372,2023,《中国科学院院刊》新媒体,
373,2023,中国亚洲象生态廊道建设构想及相关保护建议,
374,2023,三工位阴极转移系统,
375,2023,相干光场波前测量仪,
376,2023,动物全景PET-CT,
377,2023,高功率固体飞秒激光器,
378,2023,单细胞精准分选仪,
379,2023,STED超分辨光学显微镜,
380,2023,肺功能测试仪,
381,2023,欢迎订阅《中国科学院院刊》,
382,2023,政策速览（2023年6月）,
383,2023,新疆吐鲁番地区沙漠与绿洲的较量,
384,2023,立足智库期刊定位 讲好中国科技故事——《中国科学院院刊》持续关注“一带一路”科技创新与合作,
385,2023,欢迎订阅《中国科学院院刊》,
386,2023,高精度X射线压弯聚焦镜,
387,2023,光镊拉曼检测与分选仪,
388,2023,心血管功能测试仪,
389,2023,快讯：《中国科学院院刊》第七届编委会第二次会议暨第一届青委会第二次会议成功召开,
390,2023,原子层沉积系统,
391,2023,碳化硅晶体生长炉,
392,2023,水质监测水面机器人,
393,2023,生物切片阵列大面积离子减薄仪,
394,2023,入侵植物互花米草防治：理念、技术与实践,
395,2023,系列膜乳化器,
396,2023,激光干涉仪,
397,2023,激光扫描共聚焦显微镜,
398,2023,系列深紫外准分子激光器,
399,2023,中国科学院香河大气综合观测试验站,
400,2023,"大气,14,CO,2,观测：碳排放评估的新方法",
401,2023,有机、无机薄膜沉积设备,
402,2023,特高温特高压真三轴压缩与压裂实验仪,
403,2023,《中国科学院院刊》新媒体,
404,2023,氩-39高倍预富集装置,
405,2023,微牛级推力自适应测量扭摆装置,
406,2023,复兴路上的科学家精神：新时代·新青年——中国科学院上海光学精密机械研究所林尊琪多功能激光系统研制攻关突击队：以多功能激光系统点亮新篇,
407,2023,太赫兹混频探测器,
408,2023,呼吸热量代谢测试仪,
409,2023,硅神经微电极,
410,2023,场发射扫描电子显微镜,
411,2023,金属复杂薄壁构件超高速冲击液压成形设备,
412,2023,北斗/GNSS空间大气关键参数一体化探测仪,
413,2023,海洋重力仪,
414,2023,气体泄漏傅立叶红外光谱扫描成像仪,
415,2023,超广角共焦激光造影仪,
416,2023,目录,
417,2023,显微共焦拉曼荧光光谱测量模块,
418,2023,20英寸大面积微通道板型光电倍增管,
419,2023,离子溅射仪,
420,2023,高精度光学镜面,
421,2023,个人辐射报警仪,
422,2023,目录,
423,2023,“建设世界科技强国”专刊 编者按,
424,2023,光电瞄准与发射装置,
425,2023,大型岩体动态性能测试系统,
426,2023,便携式傅里叶红外多组分气体分析仪,
427,2023,政策速览（2023年7月）,
428,2023,复兴路上的科学家精神：新时代·新青年——中国科学院上海药物研究所谢毓元突击队：新药无坦途，瓶罐有真味,
429,2023,跨尺度纳米轮廓仪,
430,2023,TDLAS气体检测分析仪,
431,2023,科学普及“一体两翼”的平台实践与探索——以“科创中国-院士开讲”为例,
432,2023,磁控溅射台,
433,2023,污染物分布红外光谱成像遥测系统,
434,2023,气候变化与人的心理及行为适应示意,
435,2023,中国科学院海外科教合作中心,
436,2023,目录,
437,2023,跨越“中等技术陷阱”与实现中国式现代化,
438,2023,傅里叶变换红外光谱辐射分析仪,
439,2023,动态时频校准时间同步设备,
440,2023,欢迎订阅《中国科学院院刊》,
441,2023,欢迎订阅《中国科学院院刊》,
442,2023,如何改进应用技术系统,
443,2023,政策速览（2023年10月）,
444,2023,微型流化床反应动力学分析仪,
445,2023,中国科学院珠穆朗玛大气与环境综合观测研究站,
446,2023,大数据时代耕地红线管控监测的机遇与挑战,
447,2023,核与辐射应急车载平台,
448,2023,分子束外延系统,
449,2023,共聚焦拉曼光谱仪,
450,2023,目录,
451,2023,纤维增强复合材料超快激光切割装备,
452,2023,封二,
453,2023,超连续谱激光器,
454,2023,乳腺/灵长类诊断正电子发射断层成像系统,
455,2023,重大自然灾害后心理危机干预体系建设探讨,
456,2023,体外人胚胎研究“14天规则”亟待调整：基于科学、伦理、政策的综合视角分析,
457,2023,超导纳米线单光子探测系统,
458,2023,系列磁悬浮分子泵,
459,2023,欢迎订阅《中国科学院院刊》,
460,2023,原子水平重力梯度仪,
461,2023,科技人口、隐性技术知识与中国应用技术系统,
462,2023,机载双频激光雷达,
463,2023,乏燃料组件水下形貌尺寸测量系统,
464,2023,近钻头方位伽马成像地质导向系统,
465,2023,大气成分差分光学吸收光谱在线监测系统,
466,2023,9.4T超高场人体全身磁共振成像磁体系统,
467,2023,光谱椭圆偏振仪,
468,2023,政策速览（2023年8—9月）,
469,2023,美丽高原湖泊湿地“花—鱼—螺蚌—鸟”生态修复新路径及其应用,
470,2023,氟化钡闪烁晶体探测器,
471,2023,单频激光噪声测试仪,
472,2023,极端电磁屏蔽分布式光纤多参量监测系统,
473,2023,数字眼底成像仪,
474,2023,鄱阳湖极端干旱的影响、成因与对策,
475,2023,“一带一路”科技聚焦,
476,2023,城市多源固废协同利用与区域绿色循环发展研究——以东莞海心沙国家资源循环利用示范基地为例,
477,2023,高密度等离子体刻蚀机,
478,2023,大动态范围积分球辐射源,
479,2023,三江源国家公园生物多样性保护创新及实践,
480,2023,我国西南喀斯特生态修复的十大问题与对策,
481,2023,空间环境模拟设备,
482,2023,封四,
483,2023,闪烁体性能检测仪,
484,2023,集束型纳米薄膜生长系统,
485,2023,中国耕地资源利用的“五化”态势与治理对策,
486,2023,我国生态文明建设地理图景设计研究,
487,2023,封三,
488,2023,中国重污染产业空间集聚及其环境效应：特征与启示,
489,2023,我国大型复杂污染场地治理修复的挑战与对策,
490,2023,中国生态文明制度体系建设进展与走向,
491,2023,构建山区综合减灾与特色产业协同模式，助力我国山区高质量发展,
492,2023,长江流域水生态调度与长江模拟器研发,
493,2023,发展特色资源植物 助力美丽中国建设,
494,2023,发挥科技支撑作用，全面推进美丽中国建设——“科技助力‘全面推进美丽中国建设’”专刊序言,
495,2023,中国科学院珠穆朗玛大气与环境综合观测研究站,
496,2023,《中国科学院院刊》新媒体,
497,2023,复兴路上的科学家精神：新时代·新青年——中国科学院声学研究所汪德昭深蓝突击队：身为国之利剑，守卫祖国深蓝,
