,year,title_cn,author_cn
3500,2015,中国科学传统及其世界意义,
3501,2015,[2015年第1期]   关于制定数字“‘ 丝绸之路经济带’ 与信息化基础设施建设科技支撑计划”的思考,
3502,2015,对我国自然资源产权制度建设的战略思考,
3503,2015,建设“中斯科教合作中心”推进“一带一路”战略,
3504,2015,[2015年第1期]  社会治理与社会活化能研究,
3505,2015,我国空间站的空间科学与应用任务,
3506,2015,世界互联中的创业生态系统,
3507,2015,[2015年第1期]  社会谣言传播动力学分析,
3508,2015,工业机器人运用技术,
3509,2015,[2015年第1期]  中国科学院工程研究中心建设的思考和建议,
3510,2015,我国机器人产业现状分析与发展研判,
3511,2015,[2015年第1期]   社会治理结构的层阶优化三定则,
3512,2015,加强土壤和产地环境管理促进农业可持续发展,
3513,2015,[2015年第1期]  关于制定“基础科技支撑‘ 丝绸之路经济带’ 发展计划”的思考,
3514,2015,[2015年第1期]  关于加快制定并推进“‘ 丝绸之路经济带’ 建设科技支撑行动计划”的建议,
3515,2015,[2015年第2期] 新任命的中国科学院副院长王恩哥简介,
3516,2015,[2015年第1期]  关于制定“‘ 丝绸之路经济带’ 重大工程建设与安全科技支撑计划”的思考,
3517,2015,科技发达国家国立科研机构过去二十年改革发展观察,
3518,2015,直面挑战追梦核裂变能可持续发展——“未来先进核裂变能——ADS嬗变系统”战略性先导科技专项及进展,
3519,2015,[2015年第1期]  2015年国际原油市场走势分析与价格预测,
3520,2015,[2015年第1期]   关于制定并推进“‘ 丝绸之路经济带’ 国际智库网络与协同平台科技支撑计划”的思考,
3521,2015,[2015年第2期] 工程研究中心发展的中美差异分析及其思考和启示,
3522,2015,专利拍卖在我国的发展机遇与挑战,
3523,2015,[2015年第1期]   社会事件网络舆情的政府干预机制,
3524,2015,我国油品对机动车尾气排放的影响及升级经济性分析,
3525,2015,机器人学与自动化的未来发展趋势,
3526,2015,[2015年第2期] 中国科学院获2014年度科学技术奖简介,
3527,2015,浅谈我国土壤质量变化与耕地资源可持续利用,
3528,2015,美国国家科学基金会设施的管理及启示,
3529,2015,农业机器人的发展现状及展望,
3530,2015,面向全球经济治理的世界地缘政治经济结构探析,
3531,2015,我国耕地资源开发利用的问题与整治对策,
3532,2015,全球工业4.0大趋势:大中华智慧机器人产业的商机与挑战,
3533,2015,高海拔宇宙线观测站对地方科教及经济社会的影响,
3534,2015,打开通往新物理世界的大门——“江门中微子实验”先导科技专项及进展,
3535,2015,2016年国际原油市场走势分析与价格预测,
3536,2015,土壤安全的概念与我国的战略对策,
3537,2015,2014年度中国科学院杰出科技成就奖获奖个人和集体简介,
3538,2015,推进土壤污染防治立法奠定生态环境安全基石,
3539,2015,[2015年第1期]  第五届中德前沿探索圆桌会议综述,
3540,2015,新任命的中国科学院副院长谭铁牛简介,
3541,2015,空间科学对国家科技、经济与社会发展的作用,
3542,2015,日本“福岛核事故”灾后救援现场亲历与思考,
3543,2015,"“大气国十条”实施以来京津冀PM,2.5,控制效果评估报告",
3544,2015,2016年中国经济增长形势展望,
3545,2015,国际机器人与自动化研究交流与合作平台——IEEE机器人学与自动化学会,
3546,2015,[2015年第2期] 科研进展,
3547,2015,[2015年第1期]  科研进展,
3548,2015,中国空间科学在世界空间研究中的地位——欧空局前副局长Roger-Maurice Bonnet专访,
3549,2015,“土壤与生态环境安全——国际土壤年在中国”纪念活动成功举行,
3550,2015,科研进展,
3551,2015,向科研欺诈宣战,
3552,2015,新世纪中国空间科学的发展及展望——中国国家航天局前副局长郭宝柱专访,
3553,2015,科研进展,
3554,2015,金属有机化学国家重点实验室,
3555,2015,首届中国科学院科技促进发展奖获奖成果和集体简介,
3556,2015,科研进展,
3557,2015,催化基础国家重点实验室,
3558,2015,高分子物理与化学国家重点实验室,
3559,2015,分子反应动力学国家重点实验室,
3560,2015,科研进展,
3561,2014,中国可持续发展新评估体系的战略构想,
3562,2014,污染场地健康与环境风险评估软件（HERA）,
3563,2014,我国空间科学发展的挑战和机遇,
3564,2014,从自然资源核算到自然资源资产负债表编制,
3565,2014,生物计算机时代即将来临,
3566,2014,以国际化理念深化科技和教育改革,
3567,2014,可持续发展理论内涵的三元素,
3568,2014,我国土壤重金属污染现状及治理战略,
3569,2014,DNA纳米技术与生物编程,
3570,2014,2014年我国经济形势展望及预测,
3571,2014,空间科学——我国创新驱动发展的重要阵地,
3572,2014,我国工业污染场地土壤与地下水重金属修复技术综述,
3573,2014,实施“率先行动计划”建设科技服务网络——关于中国科学院知识产权工作的思考,
3574,2014,大数据 大科学 大发现——大数据与科学发现国际研讨会综述,
3575,2014,规模化治理土壤重金属污染技术工程应用与展望——以江铜贵冶周边区域九牛岗土壤修复示范工程为例,
3576,2014,全国生态环境十年变化（2000—2010年）遥感调查评估,
3577,2014,成果权属事关科技成果的产出和转化——我国财政资助科技成果权属政策的演进与局限,
3578,2014,我国空间科学发展政策问题初探,
3579,2014,关于重金属污染土壤风险控制区划的研究与建议,
3580,2014,硅谷模式与中国互联网创新,
3581,2014,中国生物安全实验室标准化管理体系的思考与建议,
3582,2014,DNA计算技术的发展与应用,
3583,2014,中国清洁能源的战略研究及发展对策,
3584,2014,中国标准化战略的审视与前瞻,
3585,2014,我国国际标准化发展亟需战略规划——ISO战略规划的制定和实施及启示,
3586,2014,工业互联网发展与“两化”深度融合,
3587,2014,中国科学院地球科学领域学科分析与建议,
3588,2014,开启中国认识宇宙的新篇章——空间科学战略性先导科技专项及进展,
3589,2014,生态红线的实践与思考,
3590,2014,面向应用的生态系统服务研究与展望,
3591,2014,信息消费：拉动内需增长的重大领域——信息消费发展特征及政策建议,
3592,2014,空间时代的天文学研究——从空间天文观测到诺贝尔物理学奖,
3593,2014,可持续发展的生态限制模型及对中国转型发展的政策意义,
3594,2014,以开放的人才政策支撑中国可持续发展,
3595,2014,科技体制改革是全面深化改革的重要任务,
3596,2014,美国巴特尔纪念研究院的市场化运行机制及启示,
3597,2014,细胞计算进展与展望,
3598,2014,国际空间科学发展态势研究与思考,
3599,2014,加快科技成果转化 让社会财富不断涌流,
3600,2014,标准化：产业与技术协同发展的重要基石,
3601,2014,智慧城市是新型城镇化的动力标志,
3602,2014,中国科学院大气灰霾研究进展及展望,
3603,2014,体内生物分子计算系统的原理、进展和展望,
3604,2014,新时期中国科研机构标准化工作现状剖析和思考,
3605,2014,新一轮工业革命与我国创新能力建设的思考,
3606,2014,中国互联网产业创新发展的战略思考,
3607,2014,DNA计算在信息安全领域的影响与应用,
3608,2014,促进电子商务知识产权保护的战略思考——基于行政管理的视角,
3609,2014,我国专利行政执法发展路径的制度思考,
3610,2014,影响制约科技成果转化和知识产权运用的问题分析与对策研究,
3611,2014,基于核酸的信息安全技术研究现状及发展建议,
3612,2014,知识产权战略——创新驱动发展的重要抓手,
3613,2014,中国市场定义产品的时代和技术赶超——二论中国自主创新的战略问题,
3614,2014,中关村知识产权金融创新的探索、实践与思考,
3615,2014,“创业中国”工程——创新驱动发展的加速器,
3616,2014,天文望远镜技术发展现状及对我国未来发展的思考,
3617,2014,互联网企业并购整合的政策思考,
3618,2014,加强知识产权管理践行创新驱动发展,
3619,2014,科学基金国际合作促进基础研究发展的若干思考,
3620,2014,以国际新兴理念思考我国的国际科技合作,
3621,2014,全球视野下的中国科技崛起,
3622,2014,颠覆产业世界的互联网基因,
3623,2014,枢纽-网络结构：区域发展的新组织模式,
3624,2014,凝心聚力 攻坚克难 为全面深化改革和早日实现“四个率先”目标而奋斗,
3625,2014,从创新驱动发展视角审视我国职务发明人的权益保护,
3626,2014,关于经络系统研究的评述和建议,
3627,2014,实施国际化推进战略率先建设国际一流科研机构,
3628,2014,大数据时代的城市运行管理信息协同模式研究,
3629,2014,推动科技创新与文化产业融合发展的思考,
3630,2014,传承历史 创新未来——纪念中国科学院建院 65 周年,
3631,2014,中国自主创新的战略问题,
3632,2014,中国人口、资源与环境面临的突出问题及应对新思考,
3633,2014,能源经济学： 新的挑战与应对之道——国际能源经济学会（IAEE）第四届亚洲大会综述,
3634,2014,肩负科学使命勇挑探月重担——中国科学院在“嫦娥三号”任务中的重要作用,
3635,2014,美国生物能源产业生态系统演化过程研究,
3636,2014,在新的起点上蓄势再出发——纪念中国科学院和德国马普学会科学合作四十周年,
3637,2014,需求导向优势互补合作共赢推进野外站联盟建设——野外站联盟建设的进展与展望,
3638,2014,2014年国际原油市场走势分析与价格预测,
3639,2014,现代思想库建设的战略内涵,
3640,2014,科研进展,
3641,2014,中国特色自主创新道路（1949—2012),
3642,2014,结构调整、范式转换与“第三次工业革命”,
3643,2014,机制创新科技驱动市场导向促进西藏农牧民增收——基于西藏三个村农牧民增收实践的思考,
3644,2014,2014年我国房地产市场展望与预测,
3645,2014,可持续发展新评估体系的战略意义,
3646,2014,能源经济学研究前沿 专家视点,
3647,2014,浅析我国科普网站发展的问题与策略——以中国科学院科学普及网站为例,
3648,2014,需求牵引创新科技驱动发展——科技支撑西藏樟木地质灾害防治的实践与思考,
3649,2014,国立科研机构信息传播管理现状及发展建议——以中国科学院信息传播调查为例,
3650,2014,巴西生物能源产业生态系统演化过程研究,
3651,2014,科研进展,
3652,2014,深紫外固态激光源前沿装备研制,
3653,2014,2013年度中国科学院杰出科技成就奖简介,
3654,2014,以改革创新精神全面推进学部建设——中国科学院第十七次院士大会综述,
3655,2014,科研进展,
3656,2014,中国科学院获2013年度国家科学技术奖简介,
3657,2014,科研进展,
3658,2014,科研进展,
3659,2014,科研进展,
3660,2013,数字地球：十五年发展与前瞻,
3661,2013,科研进展,
3662,2013,科研进展,
3663,2013,中国遥感发展及其贡献,
3664,2013,蓬勃发展的中国空间微波遥感技术,
3665,2013,中国遥感卫星地面站及其陆地观测卫星数据接收和处理系统,
3666,2013,中国地理信息系统的发展与展望,
3667,2013,全球空间对地观测五十年及中国的发展,
3668,2013,主体功能区战略与优化国土空间开发格局,
3669,2013,京津冀大气霾污染及控制策略思考,
3670,2013,优化我国城镇化 空间布局的战略重点与创 新思路,
3671,2013,中国林业遥感技术与应用发展现状及建议,
3672,2013,面向未来的新一代生物育种技术——分子模块设计育种,
3673,2013,大气灰霾追因与控制,
3674,2013,从生态学观点看生态文明建设,
3675,2013,全球陆表特征参量产品生成与应用研究,
3676,2013,新起点——中国经济发展格局的转变与政策选择,
3677,2013,中国首颗民用测绘卫星——“资源三号”数据处理和应用,
3678,2013,水土资源约束下保障粮食安全的战略思考,
3679,2013,HY-2A卫星及在海洋灾害监测中的应用潜力分析,
3680,2013,生态文明背景下循环经济理论的深化研究,
3681,2013,大气环境污染的健康效应研究回顾,
3682,2013,激光成像雷达技术和系统研制,
3683,2013,空间信息技术减灾应用及服务,
3684,2013,基于证据的政策制定：英国的实践与启示,
3685,2013,推进生态文明建设的顶层设计,
3686,2013,微波遥感机理模型研究进展,
3687,2013,中国极轨气象卫星遥感技术的发展,
3688,2013,关于大气污染控制技术的几点思考,
3689,2013,科研进展,
3690,2013,重塑能源 实现可持续发展,
3691,2013,中国气象卫星的发展及应用,
3692,2013,生态文明建设的控制论机理、认识误区与融贯路径,
3693,2013,新时期的中国农业发展：机遇、挑战和战略选择,
3694,2013,科技支撑我国生态文明建设的探索、实践与思考,
3695,2013,深入学习贯彻党的“十八大”精神 加快落实生态文明建设战略部署,
3696,2013,我国耕地资源保护与地力提升,
3697,2013,我国农业信息化发展的瓶颈与应对策略思考,
3698,2013,辨证看待中国专利的数量与质量,
3699,2013,我国农作物生物育种发展战略思考,
3700,2013,长江三角洲城镇密集区的城市化发展态势、动力与趋势,
3701,2013,国外农业物联网技术发展及对我国的启示,
3702,2013,发展现代农业的技术选择与实现路径,
3703,2013,国外主要科研机构和高校知识产权管理及其对我国的启示,
3704,2013,生态文明的理论内涵与计量模型,
3705,2013,我国海洋资源的合理开发与保护,
3706,2013,坚持政产学研用 实现中国遥感卫星质量的飞跃,
3707,2013,科研进展,
3708,2013,对新时期我国生态农业建设的思考,
3709,2013,面向“创新2020”的知识产权战略布局的分析与建议,
3710,2013,生态文明建设的路线图与制度保障,
3711,2013,中国生态系统研究网络与自然生态系统保护,
3712,2013,低阶煤的结构特点与热解技术发展概述,
3713,2013,科研进展,
3714,2013,未来10 年中国可能发生的19 个重大科技突破,
3715,2013,东方巨人的两个“大脑”：对生态文明建设的科学共识与决策共识,
3716,2013,我国农业物联网发展现状及对策,
3717,2013,水资源管理与生态文明建设,
3718,2013,建设先进网络基础设施支撑教育信息化发展和应用,
3719,2013,充分发挥环保主阵地作用大力推进生态文明建设,
3720,2013,生态文明建设的文化思考,
3721,2013,农业发展与生态文明建设,
3722,2013,保障综合资源安全,
3723,2013,以矿产资源可持续利用促进生态文明建设,
3724,2013,生态文明建设的公民科学素养,
3725,2013,中国干旱区城镇化发展现状及新型城镇化路径选择,
3726,2013,生态文明——人类社会发展的追求,
3727,2013,序一,
3728,2013,推进数据密集科学发现 提升科技创新能力：新模式、新方法、新挑战——《第四范式：数据密集型科学发现》译著出版,
3729,2013,欧洲研究基础设施路线图的制定及启示,
3730,2013,高能物理实验的数据密集型计算,
3731,2013,序二,
3732,2013,我国山区城镇化的战略影响及其发展导向,
3733,2013,“振兴东北”以来区域城镇化进展、问题及对策,
3734,2013,传统农区城镇化研究,
3735,2013,关于发展农业物联网的几点认识,
3736,2013,基于地缘战略的南亚地区科技合作思考,
3737,2013,中国肉品供给安全及其生产保障途径,
3738,2013,两栖创新生态系统：我国高技术企业快速发展新模式,
3739,2013,面向国家知识产权战略实施的知识产权管理及其促进政策,
3740,2013,平稳增长条件下中国各省市自治区的排放需求估算,
3741,2013,依靠市场机制实现节能减排——“碳排放交易机制理论进展与实证经验”国际研讨会综述,
3742,2013,天津市农业物联网区域试验工程的实践,
3743,2013,论地学科研信息化环境,
3744,2013,国际气候谈判中的国家集团分析,
3745,2013,中国科学院科研信息化基础设施及应用,
3746,2013,加强科技平台建设推动科技资源共享,
3747,2013,虚拟天文台——天文学研究的科研信息化环境,
3748,2013,中国科学院科研信息化回顾与展望,
3749,2013,中国式“不差钱”与中国式“钱荒”之悖论,
3750,2013,利用科研信息化手段推动微生物研究与应用,
3751,2013,空间观测全球变化敏感因子的机理与方法,
3752,2013,知识产权分析评议基本问题研究,
3753,2013,环境基准与风险评估国家重点实验室,
3754,2013,关于加强我国公共卫生应急反应体系建设的思考,
3755,2013,2013年国际原油市场走势分析与价格预测,
3756,2013,对地观测与全球环境变化——第三十五届国际环境遥感大会综述,
3757,2013,深紫外固态激光源光电子能谱仪系列装备,
3758,2013,当今美国社会中的科技事业：挑战与变革——2012 年美国总统科技顾问委员会行政报告述评,
3759,2013,我国科技评价的问题分析与改革思路,
3760,2013,2013年中国经济形势展望,
3761,2013,实现开放获取 支撑科技创新——有关国家和机构支持科技期刊开放出版的政策与措施,
3762,2013,音容笑貌犹在 学术风骨永存——怀念郭慕孙先生,
3763,2013,在世界上首报2型糖尿病尿核糖异常升高,
3764,2013,未来10年世界可能发生的22个重大科技事件,
3765,2013,纪念钱三强先生诞辰百年——即将出版的《钱三强传》的“导言”与“结语”,
3766,2013,钱三强的科学实践和科学思想——三强先生诞辰100 周年纪念,
3767,2013,中国科学院获2012年度国家科学技术奖简介,
3768,2013,加强国家药品应急信息化建设的建议,
3769,2012,人类心理毕生发展理论,
3770,2012,人脑功能连接组关联研究（fCWAS）,
3771,2012,认知心理学：探索人类的智能,
3772,2012,天文望远镜(含1.56米光学望远镜、25米),
3773,2012,概率统计的研究与发展,
3774,2012,运筹学发展的回顾与展望,
3775,2012,情绪与认知的脑机制研究进展,
3776,2012,人格心理学：人性及其差异的研究,
3777,2012,大数据研究：未来科技及经济社会发展的重大战略领域——大数据的研究现状与科学思考,
3778,2012,生理心理学：一门探索心理活动、行为活动以及神经活动之间交互作用的科学,
3779,2012,创造力心理学与杰出人才培养,
3780,2012,军事心理学：为国防安全服务的心理学科,
3781,2012,工程心理学作用、地位和进展,
3782,2012,人类决策：基础科学研究中富有前景的学科,
3783,2012,运动心理学：追求卓越与保持健康,
3784,2012,基础数学的一些过去和现状,
3785,2012,社会认知、文化与大脑——文化神经科学研究,
3786,2012,聚焦重大社会现实问题的社会心理学研究,
3787,2012,研究灾害与心理创伤促进心理康复与和谐,
3788,2012,散裂中子源,
3789,2012,心理学——自然科学与社会科学的交叉,
3790,2012,促进科研基础设施共享的探索与启示,
3791,2012,发展认知神经科学：理解和促进人类心理发展的新兴学科,
3792,2012,心理治疗：理论学派、研究及发展,
3793,2012,心理学实验方法：科学心理学发展的根本,
3794,2012,理论心理学：概念与展望,
3795,2012,心理测量学：心理学皇冠上的数学明珠,
3796,2012,法律心理学：一门促进司法公正的应用学科,
3797,2012,中国科学院重大科技基础设施建设的回顾与思考,
3798,2012,教育心理学：沟通心理学与教育的桥梁,
3799,2012,神光I、II装置,
3800,2012,健康心理学研究的回顾与展望,
3801,2012,北京正负电子对撞机及其重大改造工程,
3802,2012,子午工程,
3803,2012,心理统计分析：趋势、契机与展望,
3804,2012,序一　加强大科学装置建设　迎接新科技革命挑战,
3805,2012,上海同步辐射光源,
3806,2012,未来先进核裂变能——TMSR核能系统,
3807,2012,郭守敬望远镜,
3808,2012,兰州重离子研究装置,
3809,2012,“实验１”（SWATH）海洋考察船,
3810,2012,500米口径球面射电望远镜,
3811,2012,科学计算:科技创新的第三种方法,
3812,2012,大亚湾反应堆中微子实验站,
3813,2012,国家同步辐射实验室（合肥）,
3814,2012,序二 大科学装置——国家科学技术综合实力的重要标志,
3815,2012,超导托卡马克核聚变实验装置,
3816,2012,中国遥感卫星地面站,
3817,2012,中国西南野生生物种质资源库,
3818,2012,强磁场实验装置（稳态）,
3819,2012,长短波授时系统,
3820,2012,遥感飞机与航空遥感系统,
3821,2012,科研进展,
3822,2012,蛋白质科学研究上海设施,
3823,2012,九层之台 起于累土（代序）,
3824,2012,羊八井宇宙线观测站,
3825,2012,重点实验室的建设与发展,
3826,2012,编者的话,
3827,2012,环境保护与可持续发展,
3828,2012,解读生物能源:新能源产业及对环境、生态与社会经济发展的影响,
3829,2012,基于青年科技人才需求特征的激励机制探讨,
3830,2012,关于控制论的几点蠡测,
3831,2012,高新区创新中国——对20年国家高新区发展的总结评价及对未来发展的思考,
3832,2012,国家创新平台体系建设的回顾与展望,
3833,2012,社会-经济-自然复合生态系统与可持续发展,
3834,2012,以重大成果产出为导向改革科技评价,
3835,2012,全球城市化进程动态监测与分析,
3836,2012,从社会计算到社会制造：一场即将来临的产业革命,
3837,2012,未来先进核裂变能——ADS嬗变系统,
3838,2012,从黄禹锡事件谈科技伦理教育,
3839,2012,深紫外激光光发射电子显微镜(PEEM),
3840,2012,中国可持续发展的理论与实践,
3841,2012,中国矿产资源与可持续发展,
3842,2012,谁是“全球变暖”的主因——碳的自然排放源与地球化学循环及气候变化主因研究评述,
3843,2012,中国水资源与可持续发展,
3844,2012,新型城市化建设：中国城市社会发展的战略选择,
3845,2012,《中国21世纪议程》:迎接挑战的战略抉择与实践探索,
3846,2012,区域可持续发展研究的兴起与作用,
3847,2012,深紫外激光光化学反应仪与在线检测系统,
3848,2012,太阳物理研究与发展,
3849,2012,2011年中国科学院杰出科技成就奖获奖个人和集体简介,
3850,2012,计算机数学的发展与展望,
3851,2012,科学与可持续发展——TWAS第十二次学术大会暨第二十三届院士大会综述及启示,
3852,2012,将“人”字写在天上:从ELSI到HELPCESS——试谈当前生命伦理讨论中的若干问题,
3853,2012,基础研究与战略性新兴产业发展,
3854,2012,民主办院  开放兴院  人才强院  加快出成果  出人才  出思想,
3855,2012,中能重离子微束辐照装置,
3856,2012,创新社会管理中的网络舆论引导研究,
3857,2012,科研进展,
3858,2012,2012年国际原油市场走势分析与价格预测,
3859,2012,应对气候变化的碳收支认证及相关问题,
3860,2012,知识产生方式和科技决策支撑的重大变革——面向大数据和开源信息的科技态势解析与决策服务,
3861,2012,澳大利亚科学院科学咨询职能及启示,
3862,2012,高能天体物理学研究与发展,
3863,2012,低阶煤清洁高效梯级利用关键技术与示范,
3864,2012,美国科技决策咨询的体制机制及其对我国的启示,
3865,2012,规范和完善我国干细胞研究与临床应用的伦理审查和过程监管机制势在必行,
3866,2012,基于超网络的舆论领袖识别应用研究,
3867,2012,社会行为选择的力学注记——网络社会管理基础研究之一,
3868,2012,应对气候变化与可持续发展,
3869,2012,抗2型糖尿病候选新药和干预新方法的系统性研究,
3870,2012,把握复杂科学结构揭示创新动态趋势——《科学结构地图》系列专著介绍,
3871,2012,基于超网络的社会舆论形成及应用研究,
3872,2012,基于超网络的社会舆论演化及应用研究,
3873,2012,农业节水研究进展及未来发展战略,
3874,2012,人水关系的和谐论研究,
3875,2012,中国人口与可持续发展,
3876,2012,中国科学院知识创新工程评估方法,
3877,2012,研究社会心理行为  推进社会管理创新,
3878,2012,生物多样性保护与生物资源永续利用,
3879,2012,中国能源经济发展阶段及中长期节能潜力,
3880,2012,恒星物理研究与发展,
3881,2012,从Nature看化学科学的发展——为《〈自然〉学科经典系列:化学的进程》的出版而作,
3882,2012,中国可持续发展20年回顾与展望,
3883,2012,我国区域能源效率指数分析与展望,
3884,2012,2012年中国经济形势展望及预测,
3885,2012,纳米伦理:寻求未来安全的伦理,
3886,2012,科技政策学(SoSP):科技政策研究的新阶段,
3887,2012,远距离量子通信实验研究——迈出我国实用化量子通信网络发展第一步,
3888,2012,中国实现水需求零增长的可能性探讨,
3889,2012,积极探索中国环保新道路  促进经济社会可持续发展,
