,year,title_cn,author_cn
1788,2020,抗击新冠肺炎——中国科学院在行动,
1789,2020,授时信号模拟器,
1790,2020,任意序列发生器,
1791,2020,中国科学院野外站科研样地建设试点,
1792,2020,激光扫描共聚焦显微镜,
1793,2020,关于科技在应对重大突发公共卫生事件中发挥统筹协同作用的思考,
1794,2020,北亚热带山地生物多样性的长期监测研究及生态建设,
1795,2020,微秒脉冲电源,
1796,2020,在线OD测量仪,
1797,2020,单频种子激光器,
1798,2020,LIBS元素成分非接触式快速分析仪,
1799,2020,超高精度压力传感器,
1800,2020,氟油检漏平台,
1801,2020,磁通门磁强计,
1802,2020,大功率中红外激光器,
1803,2020,中国科学院地质与地球物理研究所玄武岩产业科技扶贫实践,
1804,2020,小动物能谱显微CT,
1805,2020,人体肺部气体磁共振成像系统,
1806,2020,高精度光学镜面,
1807,2020,深紫外激光光致发光光谱仪,
1808,2020,正交偶极子声波测井换能器,
1809,2020,长期生态学研究支撑新疆南疆生态建设和科技扶贫,
1810,2020,微型电场传感器,
1811,2020,高能衍射仪,
1812,2020,涡轮叶片表面温度测量仪,
1813,2020,中国科学院普定喀斯特生态系统观测研究站,
1814,2020,朗缪尔探针,
1815,2020,高功率固态飞秒激光器,
1816,2020,伽玛射线成像仪,
1817,2020,激光雷达望远镜,
1818,2020,风力机外场气动/结构综合测试系统,
1819,2020,皮秒单光子发光光谱仪,
1820,2020,毫米波人体成像安全检查设备,
1821,2020,欢迎订阅《中国科学院院刊》,
1822,2020,激光抽运小型铯原子钟,
1823,2020,大面积微通道板型光电倍增管,
1824,2020,系列脂润滑分子泵,
1825,2020,目录,
1826,2020,实时通信潜标,
1827,2020,共视远程比对测量仪,
1828,2020,脉冲式电子顺磁共振谱仪,
1829,2020,磁控溅射卷绕镀膜设备,
1830,2020,1 PW超强超短激光系统,
1831,2020,中国荒漠生态系统定位研究网络生态站,
1832,2020,星载粒子辐射剂量仪,
1833,2020,半导体泵浦激光放大器,
1834,2020,雪山下的库木库里沙漠东部边缘,
1835,2020,智能化蛋白层析系统,
1836,2020,高速高精密激光调阻机,
1837,2020,光刻机系列,
1838,2020,基于介质微球透镜的近场光学超分辨显微镜,
1839,2020,电离层光度计,
1840,2020,超高通量基因测序仪,
1841,2020,ROV温度梯度传感器,
1842,2020,短相干激光干涉仪,
1843,2020,地应力测井机器人,
1844,2020,1 m口径光学望远镜,
1845,2020,蒸发镀膜设备,
1846,2020,空间环境模拟设备,
1847,2020,紫外-可见区激光三联拉曼光谱仪,
1848,2020,光栅系列,
1849,2020,单细胞拉曼分选-测序耦合系统,
1850,2020,高功率光纤飞秒激光器,
1851,2020,激光跟踪仪,
1852,2020,欢迎订阅《中国科学院院刊》,
1853,2020,基于ROV的小型钻机,
1854,2020,400-600 MHz高场磁共振波谱仪,
1855,2020,深海激光拉曼光谱原位定量探测系统,
1856,2020,目录,
1857,2020,单频激光噪声测试仪,
1858,2020,生物耗氧量在线分析仪,
1859,2020,可见与红外光轴平行度检测仪,
1860,2020,两虫样品预处理仪,
1861,2020,太赫兹量子级联激光器,
1862,2020,深海原位水体采样装置,
1863,2020,星载铷原子钟,
1864,2020,四维在体光学投影断层成像系统,
1865,2020,中国主要荒漠景观特征,
1866,2020,大功率红绿蓝单频激光器,
1867,2020,系列化深紫外全固态激光器,
1868,2020,超导磁选机,
1869,2020,新任命的中国科学院副院长、党组副书记（正部长级）阴和俊简介,
1870,2020,高灵敏在线光电离飞行时间质谱仪,
1871,2020,TIRF单分子显微镜,
1872,2020,高重复率距离门控产生器,
1873,2020,《中国科学院院刊》“建设世界科技强国”系列,
1874,2020,中国科学院生态环境研究中心 环境化学与生态毒理学国家重点实验室,
1875,2020,分子束外延系统,
1876,2020,真空泵、离子泵,
1877,2020,海底地震仪,
1878,2020,靶斑仪,
1879,2020,荧光相关光谱仪,
1880,2020,高能脉冲磁控溅射镀膜机,
1881,2020,双光子3D打印系统,
1882,2020,核磁共振微成像仪,
1883,2020,小动物在体自发荧光断层分子影像设备,
1884,2020,基于SEM的nano-CT系统,
1885,2020,二阶非线性光学测试仪,
1886,2020,大气成分差分光学吸收光谱在线监测系统,
1887,2020,微型超声换能器,
1888,2020,XRF岩石样品自动分析及大型化石表面元素分析仪,
1889,2020,600 mm激光干涉仪,
1890,2020,高通量智能音视频处理一体机,
1891,2020,海洋重力仪,
1892,2020,便携式土壤呼吸测量系统,
1893,2020,轻量型锥束CT成像系统,
1894,2020,全光驱动的团簇聚变中子源,
1895,2020,小动物光学多模融合分子影像成像系统,
1896,2020,多粒径大流量空气颗粒物采样器,
1897,2020,多波长消色差全内反射显微镜,
1898,2020,集束型纳米薄膜生长系统,
1899,2020,三维X射线晶圆级封装计量系统,
1900,2020,深海海底理化环境长期观测系统,
1901,2020,基于NB-IoT的集成式土壤墒情智能监测设备,
1902,2020,超微量DNA自动提取检测工作站,
1903,2020,单纵模纳秒脉冲光参量振荡器,
1904,2020,光纤地震计,
1905,2020,二噁英大气采样仪,
1906,2020,超声波可视化与定量观测的动态激光光弹设备,
1907,2020,激光模拟单粒子效应测试系统,
1908,2020,高温金属液流速实时在线监测仪,
1909,2020,集成电路激光精准注入分析仪,
1910,2020,6000 m级可视化可控轻型柱状取样器,
1911,2020,激光划片机,
1912,2020,细胞三维培养系统,
1913,2020,磁控溅射台,
1914,2020,昼夜大气相干长度仪,
1915,2020,红外云天仪,
1916,2020,水声试验用拖曳细长线列阵,
1917,2020,网络精密时间服务器,
1918,2020,碳化硅晶体生长炉,
1919,2020,短波连续紫外激光器,
1920,2020,编者按,
1921,2020,超导纳米线单光子探测系统,
1922,2020,生物分子界面分析仪,
1923,2020,量子态控制与读出系统,
1924,2020,单粒种子品质智能化无损通量检测分选仪器,
1925,2020,欢迎订阅《中国科学院院刊》,
1926,2020,中性团簇红外光谱装置,
1927,2020,高密度激光改性系统,
1928,2020,临床单细胞拉曼药敏性快检仪,
1929,2020,中国科学院黄土高原地球关键带与地表通量野外观测研究站,
1930,2020,奏响新时代绿色发展的长江之歌,
1931,2020,《中国科学院院刊》第三十五卷（2020年）主题索引,
1932,2020,水质监测水面机器人,
1933,2020,RAMO-C个人辐射报警仪,
1934,2020,中国科学院南京地理与湖泊研究所,
1935,2020,高密度等离子体刻蚀机,
1936,2020,氦质谱检漏仪,
1937,2020,建设世界科技强国,
1938,2020,全光驱动高能电子束,
1939,2020,深紫外激光光发射电子显微镜,
1940,2020,自适应光学视网膜成像仪,
1941,2020,多维跨尺度材料热性能分析仪,
1942,2020,大气痕量气体成像差分吸收光谱仪,
1943,2020,超导重力仪,
1944,2020,武汉加油,
1945,2020,浮游动物原位探测超分辨三维成像系统,
1946,2020,多相反应器内非均相混合特性测量系统,
1947,2020,高精度电光晶体定向仪,
1948,2020,高精度磁强计,
1949,2020,高低温空间环境模拟真空设备,
1950,2020,亚硝酸在线分析仪,
1951,2020,地下流体分层保真取样仪,
1952,2020,大气臭氧探空仪,
1953,2020,多相反应器内非均相流动特性测量系统,
1954,2020,多功能内耗仪,
1955,2020,黄曲霉毒素荧光检测器,
1956,2020,平场复消色差显微物镜,
1957,2020,微型高频超声换能器,
1958,2020,复杂结构构件的超声无损评价系统,
1959,2020,激光闪光光谱仪,
1960,2020,基于ROV的小型抓斗,
1961,2020,甚低频MEMS地震检波器,
1962,2020,连续波速调管,
1963,2020,中红外可调谐飞秒激光器,
1964,2020,高温超导接收前端,
1965,2020,新任命的中国科学院副院长高鸿钧简介,
1966,2020,微型流化床反应动力学分析仪,
1967,2020,糖尿病早期无创检测系统,
1968,2020,全自动、高分辨率、高通量植物真三维影像分析系统,
1969,2020,欢迎订阅《中国科学院院刊》,
1970,2020,抗击新冠肺炎——中国科学院在行动·续,
1971,2020,流通池荧光检测器,
1972,2020,流式细胞仪,
1973,2020,数字PCR仪,
1974,2020,10 PW超强超短激光器,
1975,2020,多功能荧光分析仪,
1976,2020,深海多参数剖面观测浮标,
1977,2020,加强面向人民生命健康的环境研究,
1978,2020,源表级多通道气体敏感测试平台,
1979,2020,公共卫生应急体系建设的战略思考,
1980,2020,分子吸附动力学原位测试系统,
1981,2020,工业全站仪,
1982,2020,天空光谱辐照度仪,
1983,2020,用科技筑牢守卫人民健康的防火墙,
1984,2020,便携式、台式爆炸物、毒品痕量检测仪,
1985,2020,新任命的中国科学院副院长周琪简介,
1986,2020,燃油喷嘴高压高温雾化特性平面激光测量系统,
1987,2020,系列化拉曼光谱探针,
1988,2020,蒸发源及控制器,
1989,2020,微颗粒实时在线监测仪,
1990,2020,飞秒脉冲形状宽度测量仪,
1991,2020,有机薄膜太阳能电池/OLED沉积设备,
1992,2020,小动物光学和光声断层多模融合分子影像设备,
1993,2020,生物结构真三维形态图像快速获取与定量分析仪,
1994,2020,目录,
1995,2020,超声相控阵检测仪,
1996,2020,单细胞物理/化学特性高通量检测分析仪,
1997,2020,高压脉冲源,
1998,2020,全天空云图仪,
1999,2020,高光束质量高功率纳秒激光器,
2000,2020,定容管活塞式油气水多相流量计,
2001,2020,扫描式岩石磁性测量仪,
2002,2020,触角电位测量系统,
2003,2020,便携式微波辐射计,
2004,2020,立足科技评价服务改革发展——中国科学院管理创新与评估研究中心成立二十周年,
2005,2020,目录,
2006,2020,皮秒条纹相机,
2007,2020,多波长飞秒全固态激光器,
2008,2020,离子阱毒品现场鉴别仪,
2009,2020,基于共振光散射的微阵列生物芯片检测系统,
2010,2020,STED超分辨光学显微镜,
2011,2020,高时空分辨的电化学-荧光耦联细胞成像系统,
2012,2020,高速并行超声信号系统,
2013,2020,水面艇用小型多普勒计程仪,
2014,2020,多路激光耦合器,
2015,2020,航天器表面电位监测器,
2016,2020,二维真空机械手,
2017,2020,超窄线宽稳频激光系统,
2018,2020,感应式磁场传感器,
2019,2020,人体多生理参数检测系统,
2020,2020,在破立并举中优化科技评价,
2021,2020,陆地-大气界面气体交换通量全自动观测系统,
2022,2020,中国科学院黑河遥感试验研究站,
2023,2020,硅神经微电极,
2024,2020,环境污染与人体健康,
2025,2020,超级基站,
2026,2020,欢迎订阅《中国科学院院刊》,
2027,2020,目录,
2028,2020,中国科学院黑河遥感试验研究站,
2029,2020,欢迎订阅《中国科学院院刊》,
2030,2020,乳腺/灵长类诊断正电子发射断层成像系统,
2031,2020,十八大以来习近平关于扶贫工作的重要讲话及批示摘编,
2032,2020,三维实时在体神经功能回路成像系统,
2033,2020,离子束生物工程装置,
2034,2020,消色差全内反射荧光照明器,
2035,2020,中国科学院策勒沙漠研究站,
2036,2020,欢迎订阅《中国科学院院刊》,
2037,2020,地面电磁探测系统,
2038,2020,无需麻醉小动物活体发光快速检测系统,
2039,2020,目录,
2040,2020,中国科学院策勒沙漠研究站,
2041,2020,科研型-光镊微操作仪,
2042,2020,科技激发脱贫的内生动力,
2043,2020,基于低频振荡的微点阵阵列/图案化制备仪器系统,
2044,2020,中国科学院神农架生物多样性定位研究站,
2045,2020,时间服务器,
2046,2020,欢迎订阅《中国科学院院刊》,
2047,2020,推进长江经济带高质量发展,
2048,2020,中国科学院神农架生物多样性定位研究站,
2049,2020,全自动干细胞诱导培养设备,
2050,2020,中国科学院千烟洲亚热带森林生态系统观测研究站,
2051,2020,欢迎订阅《中国科学院院刊》,
2052,2020,膜乳化器系列设备,
2053,2020,欢迎订阅《中国科学院院刊》,
2054,2020,目录,
2055,2020,在破立并举中优化科技评价,
2056,2020,近年来中国科学院领导的扶贫足迹,
2057,2020,欢迎订阅《中国科学院院刊》,
2058,2019,“亚洲水塔”变化与影响,
2059,2019,中国生物多样性监测与研究网络建设及进展,
2060,2019,论我国畜牧业可持续发展,
2061,2019,行星科学：科学前沿与国家战略,
2062,2019,第二次青藏高原综合科学考察研究——科考进行时,
2063,2019,世界科技中心转移的钻石模型——基于经济繁荣、思想解放、教育兴盛、政府支持、科技革命的历史分析与前瞻,
2064,2019,中国高通量计算机的自主研发之路,
2065,2019,氢能与燃料电池发展现状及展望,
2066,2019,中国植物园现状及未来发展策略,
2067,2019,能源革命中的物理储能技术,
2068,2019,新兴高性能计算行业应用及发展战略,
2069,2019,关于煤化工与石油化工的协调发展,
2070,2019,行星地质学：地质学的“地外”模式,
2071,2019,能源革命中的电化学储能技术,
2072,2019,高性能计算之源起——科学计算的应用现状及发展思考,
2073,2019,我国行星化学学科发展现状与展望,
2074,2019,中国科学院生物标本馆（博物馆）的现状与未来,
2075,2019,高性能计算机发展与政策,
2076,2019,青藏高原积雪变化及其影响,
2077,2019,畜牧业发展中抗菌药应用的“利”与“刃”,
2078,2019,中国科学技术史研究70年,
2079,2019,建立畜禽废弃物养分管理制度 促进种养结合绿色发展,
2080,2019,生物质能研究现状及未来发展策略,
2081,2019,“一带一路”上的全球生物多样性与保护,
2082,2019,加强畜禽遗传资源保护 推动我国畜牧种业发展,
2083,2019,从科教融合到科学引领――中国特色的行星科学建设思路,
2084,2019,畜禽养殖环境调控与智能养殖装备技术研究进展,
2085,2019,世界主要发达国家能源政策研究与启示,
2086,2019,青藏高原水资源演变与趋势分析,
2087,2019,影响“亚洲水塔”的水汽输送过程,
2088,2019,青藏高原及周边地区的冰川灾害,
2089,2019,铸造强国重器：关键核心技术突破的规律探索与体系构建,
2090,2019,序言：发展高性能计算需要思考的几个战略性问题,
2091,2019,中国科学院70年：国家战略科技力量建设与发展的思考,
2092,2019,核能综合利用研究现状与展望,
2093,2019,青蒿素：从中国传统药方到全球抗疟良药,
2094,2019,水声定位导航技术的发展与展望,
2095,2019,中国超算产业发展现状分析,
2096,2019,从深空探测大国迈向行星科学强国,
2097,2019,"中国技术:从发明到模仿,再走向创新",
2098,2019,肉类营养与人体健康研究的战略思考,
2099,2019,全球变暖背景下青藏高原及周边地区冰川变化的时空格局与趋势及影响,
2100,2019,新发展理念视阈下的我国畜禽疫病防控,
2101,2019,从追赶到领先――华为的创新之路,
2102,2019,以二氧化碳规模化利用技术为核心的碳减排方案,
2103,2019,我国行星物理学的发展现状与展望,
2104,2019,海底观测网的研究进展与发展趋势,
2105,2019,水声目标特征分析与识别技术,
2106,2019,科技创新助力构建国家能源新体系,
2107,2019,青藏高原多年冻土变化对水文过程的影响,
2108,2019,加强我国战略生物资源有效保护与可持续利用,
2109,2019,青藏高原最近40年湖泊变化的主要表现与发展趋势,
2110,2019,微生物与细胞资源的保存与发掘利用,
2111,2019,脑科学研究的三大发展方向,
2112,2019,论中国如何发展自主可控和开放的科技产业,
2113,2019,新时期呼唤新的科研模式――中国70年信息科技发展的回顾与思考,
2114,2019,产用融合——智能技术群驱动的第五制造范式,
2115,2019,序言：行星科学引领深空探测,
2116,2019,不忘初心，再创辉煌：声呐技术助推海洋强国梦,
2117,2019,水声通信技术进展,
2118,2019,我国实验动物资源建设的问题与展望,
2119,2019,我国战略生物资源大数据及应用,
2120,2019,青藏高原能量、水分循环影响效应,
2121,2019,“亚洲水塔”变化对青藏高原生态系统的影响,
2122,2019,水声目标探测技术研究现状与展望,
2123,2019,发展太阳能和风能发电技术 加速推进我国能源转型,
2124,2019,“水声信号处理和声呐技术·发展现状和展望”专题序言,
2125,2019,中国科学院与“两弹一星”工程,
2126,2019,“战略生物资源的保护与利用”专题序言,
2127,2019,规划科学技术：《1956—1967年科学技术发展远景规划》的制定与实施,
2128,2019,新时代建设科技强国的战略路径,
2129,2019,中国科技体制的演变,
2130,2019,“亚洲水塔”变化的灾害效应与减灾对策,
2131,2019,生态草牧业在我国精准扶贫中的作用和潜力——中国科学院植物研究所科技扶贫实践与模式探索,
2132,2019,煤炭清洁高效转化技术进展及发展趋势,
2133,2019,中国科技发展的回顾和几点建议,
2134,2019,我国水声换能器技术研究进展与发展机遇,
2135,2019,中关村科学城的兴起（1951—1999年）,
2136,2019,工业领域煤炭清洁高效燃烧利用技术现状与发展建议,
2137,2019,贫困山区生态渔业扶贫模式的实践与思考——从湖北恩施到贵州六盘水,
2138,2019,深海声传播信道和目标被动定位研究现状,
2139,2019,国际能源科技发展动态研判与战略启示,
2140,2019,“亚洲水塔”变化对下游水资源的连锁效应,
2141,2019,中国31个直辖市和省会城市“垃圾围城”风险与对策研究―基于DⅡS方法的实证研究,
2142,2019,世界贫困的时空演化格局及关键问题研究,
2143,2019,中文科技期刊的现状与困境：问卷调查分析的启示,
2144,2019,我国贫困妇女脱贫问题政策研究,
2145,2019,青藏高原河流输沙量变化与影响,
2146,2019,2019年中国经济核心指标预测,
2147,2019,“两弹一星”和工程科技的创新发展,
2148,2019,“科技创新助力构建国家能源新体系”专刊序言,
2149,2019,海洋牧场与海上风电融合发展：理念与展望,
2150,2019,中国科学技术发展应重视的几个问题,
2151,2019,七十载为国家科技发展立业 新时代创世界科技强国立功,
2152,2019,承续历史，开放协作，努力建设更高水平的国际科学合作事业,
2153,2019,“亚洲水塔”在高亚地区的社会经济作用,
2154,2019,制造范式的演进规律与发展新制造的政策建议,
2155,2019,让科学的力量更好地守护“亚洲水塔”——“‘亚洲水塔’变化及其影响”专刊序言,
2156,2019,新中国70年来中国科学院的创新、改革与发展之路,
2157,2019,极地水声信号处理研究,
2158,2019,STED超分辨光学显微镜,
2159,2019,科技工作者创造了中国科技发展70年的辉煌,
2160,2019,中美经贸摩擦背景下我国知识产权保护战略研究——基于工业机器人和智能汽车产业的专利申请数据,
2161,2019,回顾增信心 前瞻驭未来,
2162,2019,中国分散式民用供热技术现状分析,
2163,2019,我国蛋白质饲料资源短缺现状与解决方案,
2164,2019,我国国立科研机构全链条式创新的模式研究——以中国科学院物理研究所的锂离子电池研究为例,
2165,2019,中国航天技术的突破性发展,
2166,2019,连根系叶70年——从文化视角看中国科学院,
2167,2019,现代农业科技助力马铃薯产业精准扶贫——中国科学院微生物研究所马铃薯产业科技扶贫实践与启示,
2168,2019,合成孔径声呐技术研究进展,
2169,2019,我国高性能计算科技政策分析——与美国NSCI计划对比,
2170,2019,国立科研机构的建制化演进及发展趋势,
2171,2019,完善全民所有自然资源资产管理体制研究,
2172,2019,新形势下我国知识产权全球治理环境挑战与对策建议,
2173,2019,中国科学院重大科技基础设施发展概述,
2174,2019,“中国国情与发展”论坛与“十四五”规划制定,
2175,2019,第四次工业革命背景下科技强国建设人才需求分析,
2176,2019,农田生态学和长期试验示范引领黑土地保护和农业可持续发展,
2177,2019,2019年夏季全国气候趋势展望,
2178,2019,野外科学观测研究站发展潜力大应予高度重视,
2179,2019,关于中国和印度尼西亚在资源环境领域开展重点合作的建议,
2180,2019,高重频钛宝石飞秒激光放大器,
2181,2019,中国科学院大亚湾海洋生物综合实验站,
2182,2019,比较视野下的中国科学院外籍院士制度初步研究,
2183,2019,科技强国基础研究投入-产出-政策分析及其启示,
2184,2019,空间科学任务的全价值链管理和产出评估,
2185,2019,智慧城市空间信息公共平台：城市数据价值之源,
2186,2019,抓住机遇推进基础研究高质量发展,
2187,2019,中国科学院战略性先导科技专项（A类）.“变革性洁净能源关键技术与示范”,
2188,2019,核能公众接受性：研究图景、理论框架与展望,
2189,2019,发挥新型举国体制优势 构建国家洁净能源体系,
2190,2019,超声剪切波弹性成像仪器,
2191,2019,促进南方红壤丘陵区农业可持续发展的复合农业生态系统长期观测研究,
2192,2019,黄土高原丘陵沟壑区乡村可持续振兴模式,
2193,2019,多规模智库问题 DⅡS 理论方法,
2194,2019,我国基础研究管理制度面临的挑战及对策建议,
2195,2019,生态学理论与技术创新引领我国热带、亚热带海洋生态研究与保护,
2196,2019,知识产权:国际贸易的核心要素——中美经贸摩擦的启示,
2197,2019,构建立足区域资源禀赋的西部特色青年科技人才发展机制——以中国科学院院属西部研究所青年科技人才发展现状为例,
2198,2019,中国工程院外籍院士制度之探究,
2199,2019,中美经贸摩擦背景下我国科技创新和知识产权发展对策,
2200,2019,地球空间环境的野外科学观测研究,
2201,2019,基于指标评价体系的我国粮食安全演变研究,
2202,2019,对我国基础研究布局的几点思考,
2203,2019,高能脉冲磁控溅射（HiPIMS）镀膜机,
2204,2019,帕隆4号冰川,
2205,2019,开展近海生态系统长期观测 引领海洋生态系统健康研究,
2206,2019,从蓝图到宏业——华罗庚的所长就职报告与中国科学院的数学事业,
2207,2019,东海浮标综合观测网络支撑海洋环境保护和防灾减灾预报,
2208,2019,国立科研机构如何牵引核心技术攻坚体系:国际经验与启示,
2209,2019,目录,
2210,2019,强化科技强国对现代化强国的战略支撑,
2211,2019,认知“亚洲水塔”，守护生命源泉,
2212,2019,水声信号处理和声呐技术·发展现状和展望,
2213,2019,杂交水稻和杂交小麦的选育（1960—2000年）——面向国民经济主战场的新中国农业科技,
2214,2019,中国人才培养急需“双重转型”,
2215,2019,GNSS无线电掩星探测仪,
2216,2019,对科学文化与“家族式”科研组织模式的思考,
2217,2019,我国高层次科普人才培养的现状与建议,
2218,2019,中国科学院科技扶贫创新举措及成效,
2219,2019,皮秒条纹相机,
2220,2019,新疆塔里木河流域水系连通与生态保护对策研究,
2221,2019,科技成果转化逻辑下被误解的《拜杜法》——概念、事实与法律机制的厘清,
2222,2019,探索科技成果转化新模式——以中国科学院典型煤炭技术产业化为例,
2223,2019,面向科技强国的科技评价制度需要科技体制的结构性变革,
2224,2019,全自动干细胞诱导培养设备,
2225,2019,长期监测与野外控制试验揭示温带典型森林结构、功能及演变规律,
2226,2019,日美贸易摩擦中知识产权的作用及其对我国的启示,
2227,2019,科技创新助力构建国家能源新体系,
2228,2019,从中美经贸摩擦看技术转让方侵权担保责任,
2229,2019,庆祝中国科学院大连化学物理研究所建所70周年,
2230,2019,郭守敬望远镜,
2231,2019,行星科学——新学科·新梦想,
2232,2019,第二次青藏高原综合科学考察研究——科考进行时,
2233,2019,欢迎订阅《中国科学院院刊》,
2234,2019,青海湖国家自然保护区管理中亟待解决的紧迫问题及理顺体制的建议,
2235,2019,朗缪尔探针,
2236,2019,从社会需求看基础科学研究关键领域,
2237,2019,专业型硕士研究生导师绩效考评体系问题与优化——以中国科学院为例,
2238,2019,靶斑仪,
2239,2019,质子转移反应质谱仪,
2240,2019,对我国“十四五”规划若干领域发展的初步认识,
2241,2019,铸国之重器 建科技强国,
2242,2019,星载粒子辐射剂量仪,
2243,2019,双光子3D打印系统,
2244,2019,毫米波人体成像安全检查设备,
2245,2019,坚持创新驱动引领中国经济高质量发展,
2246,2019,强化国家战略科技力量是加快建设世界科技强国的关键,
2247,2019,高福：释放创造力解决“卡脖子”与“卡脑子”问题,
2248,2019,科研机构在东北地区科技成果转化的现状、挑战和建议——以中国科学院为例,
2249,2019,创新引领重大科技基础设施建设，孕育新科学发现,
2250,2019,超高真空低温扫描隧道显微镜,
2251,2019,欢迎订阅《中国科学院院刊》,
2252,2019,沙漠化土地及其治理研究推动北方农牧交错区生态恢复和农牧业可持续发展,
2253,2019,重庆市畜牧科学院,
2254,2019,目录,
2255,2019,钱七虎：科技强国是建设社会主义现代化强国的基础和核心,
