,year,title_cn,author_cn
5434,2000,运筹学:21世纪通向繁荣的大道——第15届国际运筹学会联合会大会综述,
5435,2000,从农作物产量预测看发展交叉科学研究的重要性,
5436,2000,微重力落塔成功地实现上抛工作模式,
5437,2000,高分子凝聚态的几个基本物理问题,
5438,2000,面向21世纪发展我国科学教育的建议,
5439,2000,中国科学院南京地质古生物研究所现代古生物学和地层学开放研究实验室,
5440,2000,曙光2000-II跃入世界领先行列,
5441,2000,充满活力的模式识别国家重点实验室,
5442,2000,生物信息学,
5443,2000,厚膜微压传感器研究取得重大进展,
5444,2000,中日羊八井宇宙线合作实验十年,
5445,2000,中国科学院理化技术研究所,
5446,2000,检查基因表达分析的生物技术——cDNA阵列开发成功,
5447,2000,抢救“土壤水库”治理黄土高原生态环境,
5448,2000,西部大开发中的生态环境建设和产业结构调整咨询意见,
5449,2000,发展科学技术  促进精神文明——我院与社会各界将联合举办《科学技术与精神文明》论坛活动,
5450,2000,《中国科学》《科学通报》创刊50周年,
5451,2000,关于建立客观、公正的基础研究成果评价体系的一点思考,
5452,2000,克隆大熊猫取得阶段性成果,
5453,2000,世界著名科学家为中国科技发展献计献策,
5454,2000,1999年中国十大科技进展和世界十大科技进展,
5455,2000,中国科学院外籍院士主要科技成就简介(一),
5456,2000,对研究所管理问题的几点看法,
5457,2000,中国科学院地质与地球物理研究所,
5458,2000,科技百年的启示与新世纪的展望,
5459,2000,中国科学院长春光学精密机械与物理研究所,
5460,2000,算不准原理及其意义与启示,
5461,2000,中国东部陆地农业生态系统与全球变化相互作用机理研究取得重要进展,
5462,2000,城市与工业火灾安全科学与工程,
5463,2000,可持续发展战略——21世纪中国的必然选择,
5464,2000,中国科学院声学研究所声场声信息国家重点实验室,
5465,2000,“中国科学院星”命名典礼在京举行,
5466,2000,大气污染预报研究取得新进展,
5467,2000,中日合作“环境监测与水灾监测信息系统”项目启动,
5468,2000,中日签署沙尘合作研究协议及等离子体和核聚变合作研究协议,
5469,2000,对西部研究所改革和发展的思考,
5470,2000,我国第一个嵌入式移动数据库源码公布,
5471,2000,在中国科学院第十次院士大会中国工程院第五次院士大会上的讲话(二○○○年六月五日),
5472,2000,中国科学院外籍院士主要科技成就简介(二),
5473,2000,让“神灯”之光更强、更亮、更稳定——国家同步辐射实验室及其二期工程,
5474,2000,中国科学院研究所分类定位工作的实践,
5475,2000,探索实验地理学实践地理工程学——中国科学院禹城综合试验站成立二十周年,
5476,2000,凝练目标  把握方向  以坚实的步伐沿着创新之路迈进,
5477,2000,院士增选工作改革的一种尝试——中国科学院地学部1999年院士增选第一轮试行通信评审,
5478,2000,2000年《高技术发展报告》简介,
5479,2000,药物分子设计的发展,
5480,2000,改善生态与富民增收是黄土高原生态建设的中心,
5481,2000,江泽民主席考察长春光学精密机械与物理研究所,
5482,2000,院士组团赴华北制药集团公司考察咨询,
5483,2000,面向新世纪  开创新局面,
5484,2000,中国科学院外籍院士简介(三),
5485,2000,与共和国休戚与共——庆祝中国科学院建院50周年有感,
5486,2000,中日合作亚洲季风实验——青藏高原实验(GAME-Tibet),
5487,2000,朱镕基总理在庆祝中国科学院建院50周年茶话会上的讲话  (一九九九年十一月一日),
5488,2000,江泽民  朱镕基  李岚清考察中国科学院知识创新工程试点工作,
5489,2000,石油强化开采中的重大科学技术问题,
5490,2000,中国科学院知识创新工程第二批重大项目组织实施工作已基本完成,
5491,2000,预研中的上海同步辐射装置,
5492,2000,中国科学院上海光学精密机械研究所强光光学开放研究实验室,
5493,2000,产学研联合培养在职博士生,
5494,2000,中国科学院外籍院士简介(四),
5495,2000,认真贯彻“三个代表”的重要思想为实现知识创新工程目标而奋斗,
5496,2000,发展农区牧草产业  实现棉花害虫生态治理,
5497,2000,遏制艾滋病在中国流行,
5498,2000,开展科技创新管理行为系统研究的设想,
5499,2000,基础研究是技术创新的源泉——参加全国技术创新大会有感,
5500,2000,院士组团开展“创新药物开发”咨询活动,
5501,2000,深化改革  创新机制  建设上海高技术研究发展基地,
5502,2000,关于21世纪初期加快西北地区发展的若干建议(摘要),
5503,2000,围绕国家战略目标  突出西北区域特色  组建寒区旱区环境与工程研究所,
5504,2000,努力探索我国国立科研机构评价制度,
5505,2000,中国科学院大科学工程的管理,
5506,2000,李岚清副总理为庆祝中国科学院建院50周年的贺信  (一九九九年十月二十二日),
5507,2000,中国科学院新药研究体系与重要成果,
5508,2000,中国科学院农作物育种研究取得重要成果,
5509,2000,面向21世纪中国科学院研究生教育的改革与发展,
5510,2000,中国计算机事业发展的缩影——中国科学院计算技术研究所的创立与成长,
5511,2000,知识创新与知识产权法律保护,
5512,2000,中国科学院地理科学与资源研究所,
5513,2000,上海光学精密机械研究所在强光与信息光学领域取得重要进展,
5514,2000,草炭绿化荒漠,
5515,2000,加强我国植物化学研究,
5516,2000,凝练科技目标  开创科技工作新局面,
5517,2000,继往开来把大气物理研究所建成国际水平的大气科学研究中心,
5518,2000,西部开发如何实施知识发展战略,
5519,2000,“田长霖星”命名仪式在宁举行,
5520,2000,活跃于国际科技舞台  促进科技进步和社会发展——中国科学院的国际合作与交流,
5521,2000,抓住机遇  建设国际一流水平野外台站,
5522,2000,陈嘉庚奖简介,
5523,2000,站在巨人肩上勇攀高峰——中国天文学家频获世界一流天文观测设备使用权,
5524,2000,西部开发  科技先行——在生态环境建设中发挥科学技术支撑作用,
5525,2000,建设跨世纪科技发展的创新体制,
5526,2000,对创新文化建设的思考,
5527,2000,发展高技术产业为建设创新体系做出新贡献,
5528,2000,中国科学院1999年度科技进步奖特等奖及一等奖项目简介,
5529,2000,全院大办教育开创人才培养工作新局面——在中国科学院教育工作会议上的报告(摘要),
5530,2000,2000年《科学发展报告》简介,
5531,2000,中国科学院金属研究所,
5532,2000,中国科学院1999年度发明奖一等奖项目简介,
5533,2000,在国际科技合作中不断创新——中国科学院与德国马普学会的合作,
5534,2000,处理十个关系  推进整体转制,
5535,2000,路甬祥院长率团访问英国,
5536,2000,中国科学院1999年度自然科学奖一等奖项目简介,
5537,2000,中药现代化院士论坛在吉林举办,
5538,2000,中国科学院选出第四批外籍院士,
5539,2000,全国基础研究工作会议在京召开,
5540,2000,《中国科学院院士章程》修订,
5541,2000,1999年下半年香山科学会议述评,
5542,2000,建议尽快组建国家级生物医学信息中心,
5543,2000,关于建立我国钾肥资源稳定供应体系的建议,
5544,2000,中国科学院各学部第十届常务委员会选举结果,
5545,2000,交叉科学及其发展趋势,
5546,2000,关于中国科学院创新文化建设的指导意见,
5547,2000,坚定地担负起发展第一生产力的历史重任——李岚清在两院院士大会上发表讲话,
5548,2000,《院士科普书系》首发式在京举行,
5549,2000,21世纪催化材料的发展与对策,
5550,2000,创建世界一流大学  加快发展高质量的研究生教育,
5551,2000,新院士主要科技成就(三十二),
5552,2000,中国科学院西部行动计划纲要,
5553,2000,国际交流与合作促进研究开发工作,
5554,2000,中国科学院1999年科研工作新进展,
5555,2000,中国科学院1999年科技大事记,
5556,2000,实施“西部之光”计划推动西部经济发展,
5557,2000,第二届“中国科学院优秀博士后”颁奖仪式在京举行,
5558,2000,新院士主要科技成就(一),
5559,2000,中国科学院第四届学部主席团成员名单,
5560,2000,中国科学院知识创新工程试点工作取得重大进展,
5561,2000,中国科学院2000年工作要点,
5562,2000,一九九九年逝世的中国科学院院士,
5563,1999,复杂科学与管理,
5564,1999,中国科学院国家天文观测中心,
5565,1999,中国科学院上海生命科学研究院,
5566,1999,关于学习贯彻《中共中央关于农业和农村工作若干重大问题的决定》的若干意见,
5567,1999,新任命的中国科学院副院长杨柏龄简介,
5568,1999,中国科学院三江平原沼泽湿地生态试验站,
5569,1999,峨眉山藏猕猴繁殖行为生态学研究,
5570,1999,关于缓解黄河断流的对策与建议,
5571,1999,新疆的资源环境与可持续发展,
5572,1999,中国牌深紫外非线性光学晶体──KBBF和SBBO晶体,
5573,1999,关于治理长江洪水的两点建议,
5574,1999,气候系统模式、气候数值模拟及气候预测理论研究,
5575,1999,MH-705抽余油加氢技术的工业应用及推广,
5576,1999,中国沙漠形成演化与气候变化研究,
5577,1999,中国科学院获1998年度国家杰出青年科学基金资助者名单,
5578,1999,国际生态毒理学与环境安全学会第一届亚洲会议,
5579,1999,中国科学院与中国第一颗人造地球卫星,
5580,1999,香山科学会议一九九八年科学前沿与高新技术研讨综述,
5581,1999,对1998年长江洪水的认识和今后工作的建议,
5582,1999,大天区面积多目标光纤光谱天文望远镜(LAMOST),
5583,1999,行为脑科学基础研究的现状及发展趋势,
5584,1999,发展海洋科学技术  促进资源的可持续利用,
5585,1999,在纪念中国共产党十一届三中全会二十周年座谈会上的讲话,
5586,1999,实践五号卫星科学实验任务圆满完成,
5587,1999,广州分院与地方合作共建的实践与思考,
5588,1999,中国科学院党组迅速贯彻落实中央关于解决“法轮功”问题精神,
5589,1999,巨磁电阻材料和物理研究获重要进展,
5590,1999,青年科学家郭雷当选IEEE会士,
5591,1999,关于科教兴农实现我国农业可持续发展的几点思考──学习《中共中央关于农业和农村工作若干重大问题的决定》,
5592,1999,开发缓释控释肥料  提高化肥利用率,
5593,1999,分子操纵与DNA芯片,
5594,1999,从几组数据看中国科学院的基础研究,
5595,1999,超硬CN材料的合成及性质研究取得系列成果,
5596,1999,加强省院合作  发挥综合科技优势,
5597,1999,开发聚变能  造福全人类──HT-7和HT-7U超导托卡马克核聚变实验装置,
5598,1999,参与科学决策  促进科技发展──中国科学院学部的使命,
5599,1999,山地减灾研究的国际合作,
5600,1999,我国气候灾害的特征、成因和预测研究进展,
5601,1999,卓有成效的中日合作项目──中国矿物资源探查研究中心,
5602,1999,关于新疆农业与生态环境可持续发展的建议,
5603,1999,首届“中国科学院优秀博士后”评选结果揭晓,
5604,1999,源远流长  携手发展──中国科协与中国科学院的合作历程,
5605,1999,高性能计算的应用及战略地位,
5606,1999,中国科学院应在太空科技领域发挥重要作用,
5607,1999,建设世界一流的古生物学研究中心──中国科学院南京地质古生物研究所简介,
5608,1999,第十届国际煤科学大会展望,
5609,1999,激光法制备吨级纳米硅基陶瓷粉技术及试生产系统,
5610,1999,中国科学院长春分院与俄罗斯科学院西伯利亚分院推进双边合作,
5611,1999,中国科学院野外站,
5612,1999,中国盐湖锂资源的可持续开发,
5613,1999,关于研究所机制转换及基础研究工作机制创新的几点思考,
5614,1999,关于“东北农业科技战役”运行机制的思考,
5615,1999,我国水产业态势分析及发展对策,
5616,1999,科教兴国必须重视基础研究,
5617,1999,棉属种间杂交育种体系的创立,
5618,1999,线性模型M估计大样本理论的进展与问题,
5619,1999,实施可持续发展战略  加强生态环境研究,
5620,1999,耕耘“催化”志在报国──记中国科学院院士林励吾,
5621,1999,期待再创辉煌─—祝贺中国科学院成立50周年,
5622,1999,在中国科学院纪念邓小平发表“中国必须在世界高科技领域占有一席之地”重要讲话十周年座谈会上的讲话,
5623,1999,赛先生与国民科学素质,
5624,1999,加强双边合作  发挥科技优势把北京建设成现代化国际大都市,
5625,1999,加强省院合作  促进青海经济持续发展──纪念中国科学院建院50周年,
5626,1999,中国科学院科技队伍建设五十年,
5627,1999,回顾我国科学基金制的创立与发展─—庆祝中国科学院建院50周年,
5628,1999,光辉的历史  永存的业绩,
5629,1999,坚定地走改革之路──回忆我院第一个科技体制改革汇报提纲出台前后,
5630,1999,抓住开发大西北的机遇继续推进省院科技合作,
5631,1999,研究开发机器人系列产品促进制造业技术进步,
5632,1999,建立研究所科技成果转化体系的一些设想,
5633,1999,知识创新工程的关键在于机制创新,
5634,1999,夯实院市合作基础  为更好地落实科教兴国战略共同努力,
5635,1999,老年痴呆症──全社会面临的严峻挑战,
5636,1999,从电子管和晶体管的发展看纳米电子学,
5637,1999,为打好扶贫攻坚战做贡献──中科院为贵州省培训百名县级领导干部,
5638,1999,超长定向碳纳米管列阵的制备取得突破性进展,
5639,1999,凝聚科技创新目标  大力改革体制和机制  中国科学院国家知识创新工程试点开局良好,
5640,1999,高优503面包型小麦新品种的培育与推广,
5641,1999,准一维纳米材料家族的新成员──同轴纳米电缆,
5642,1999,微重力科学的发展与应用前景,
5643,1999,关于海洛因成瘾问题的思考,
5644,1999,“两弹一星功勋奖章”获得者主要科技成就,
5645,1999,持续稳定地支持基础研究,
5646,1999,关于“中国数字地球”发展战略的建议,
5647,1999,关于基础研究的一些看法,
5648,1999,与共和国同龄的中国科学院,
5649,1999,加强省院科技合作  大力推进高新技术产业化──—纪念中国科学院建院50周年,
5650,1999,发现和优化新材料的集成组合方法,
5651,1999,中科院知识创新工程引进优秀杰出人才座谈会在京举行,
5652,1999,未来农业与可持续发展战略,
5653,1999,锐意创新  成效显著  不断进取的大连化学物理研究所,
5654,1999,在中国科学院一九九九年度工作会议上的报告(摘要)(1999年1月25日),
5655,1999,新院士主要科技成就(二十九),
5656,1999,从知识创新工程所想到的,
5657,1999,跨世纪的核科学研究重大工程──从重离子加速器到冷却储存环的研制,
5658,1999,全面推进市院科技合作努力实现科技跨越发展,
5659,1999,进一步调整和优化农业结构不断提高农业整体素质和效益,
5660,1999,中国科学院与国际山地综合开发中心的合作,
5661,1999,中国科学院院士赴大型化工企业调研,
5662,1999,草地生态建设──防止水土流失及洪水灾害的重要举措,
5663,1999,生命科学研究人才培养战略刍议,
5664,1999,对我国基础性研究投入的分析与探讨,
5665,1999,改进科研管理是当务之急,
5666,1999,1999年上半年香山科学会议述评,
5667,1999,中国科学院1998年科技大事记,
5668,1999,上海天文台在深化改革中求发展,
5669,1999,1998年中国和世界十大科技进展分别评出,
5670,1999,全球环境变化领域国际合作的新尝试,
5671,1999,科技体制改革的态势与对策,
5672,1999,绿色食品与东北地区农业持续发展,
5673,1999,中国科学院1998年度自然科学奖一等奖项目简介,
5674,1999,踏遍冰川人未老──记我国现代冰川学开创者施雅风院士,
5675,1999,新院士主要科技成就(三十),
5676,1999,中国科学院1998年度科学技术进步奖特等奖及一等奖项目简介,
5677,1999,辛勤耕耘五十载  丰硕成果献中华──中国科学院获国家级特等奖一等奖和院级特等奖成果一览,
5678,1999,计算技术研究所实施创新工程方案,
5679,1999,中国植被及生态系统对全球变化反应的研究与展望,
5680,1999,开展省院合作促进地方经济社会发展,
5681,1999,发挥学科综合优势为农业可持续发展服务,
5682,1999,组建国家天文观测中心提高我国在天文学前沿的竞争力,
5683,1999,第三届中国科学院学部主席团第七次会议召开,
5684,1999,中国科学院1998年度发明奖特等奖及一等奖项目简介,
5685,1999,我国小麦品种品质分析及发展对策,
5686,1999,新院士主要科技成就(二十七),
5687,1999,依托科研成果  发展科技企业,
5688,1999,中国科学院1997年度发明奖一等奖项目简介,
5689,1999,中国科学院数学与系统科学研究院,
5690,1999,开展院省科技合作  促进地方经济发展,
5691,1999,建立创新的研究体制  促进数学研究和人才培养出丰硕成果,
5692,1999,加速结构调整步伐  建设知识创新基地,
5693,1999,新院士主要科技成就(三十一),
5694,1999,加大改革力度  推动海洋科技创新,
5695,1999,新院士主要科技成就(二十八),
5696,1998,中国科学院首批资深院士名单,
5697,1998,澄江动物群与寒武纪大爆发,
5698,1998,为计算数学的发展奋斗终生──追忆冯康院士,
5699,1998,迎接知识经济时代  建设国家创新体系,
5700,1998,音容宛在  风范永存──忆方毅同志在中国科学院,
5701,1998,黄土高原国土整治“28字方略”的理论与实践,
5702,1998,双共振电离法研究激发态分子光谱和态分辨碰撞传能,
5703,1998,光子学的发展对当代信息技术的影响,
5704,1998,《21世纪100个科学难题》将出续集,
5705,1998,中国科学院获1997年度国家杰出青年科学基金资助者名单,
5706,1998,我国奥陶系达瑞威尔阶全球界线层型(“金钉子”)界碑揭幕,
5707,1998,中国科学技术大学庆祝建校四十周年,
5708,1998,加速培养优秀青年人才的做法和成效,
5709,1998,1998年度求是科技基金会杰出青年学者奖颁发,
5710,1998,中国科学院东湖湖泊生态系统试验站,
5711,1998,13.7米毫米波射电望远镜,
5712,1998,在1997年中国科学院院士增选结果新闻发布会上的讲话,
5713,1998,鱼类生长变异的生物能量学机制,
5714,1998,怀化——发展中西部的一着重棋,
5715,1998,让振动造福于社会──记机械动力学和工程机械专家闻邦椿,
5716,1998,成都科研基地富余人员转岗分流对策研究,
5717,1998,1997年新当选的中国科学院院士名单,
5718,1998,邓小平与科学的春天,
5719,1998,中国科学家率先揭示铍同位素示踪表土季节性迁移,
5720,1998,邓小平与中国科学院──纪念邓小平逝世一周年,
5721,1998,ENSO现象与生物灾害,
5722,1998,高亚洲浅冰芯与气候环境变化研究,
5723,1998,’98长江流域洪水的警示与治水方略,
5724,1998,中国科学院成都地区科技企业的发展,
5725,1998,推进化工生产可持续发展的途径──绿色化学与技术,
5726,1998,吸引智力回归的又一举措,
5727,1998,对基础性研究的几点看法,
5728,1998,“提出问题”是科学研究的灵魂——有感于《21世纪100个科学难题》的问世,
5729,1998,探索者的追求——记中国科学院院士叶恒强,
5730,1998,雷电物理学研究新进展,
5731,1998,《科学》杂志中国服务器开通,
5732,1998,让科学的新进展更多地出在中国——写在《过渡金属原子簇化学的新进展》出版之后,
5733,1998,“干旱与沙漠化应用研究”的进展──我国与世界实验室的合作,
5734,1998,粘性流体力学研究的若干进展,
5735,1998,遥感技术在我国洪涝灾害监测评估中的作用,
5736,1998,1997度中国科学院青年科学家奖  一等奖获得者简介,
5737,1998,中日合作成功进行“青藏高原能量水分循环试验”预试验,
5738,1998,中国科学院设立高级访问学者制度,
5739,1998,我院与第三世界科学院的交流及合作,
5740,1998,新型固体燃料电池——21世纪的绿色能源,
5741,1998,从液晶生物膜理论展望软凝聚态物理创新,
5742,1998,淮河的地位与治理,
5743,1998,艰苦的工作  光荣的使命──中国科学院野外工作的回顾与展望,
5744,1998,七个基础研究学科专家委员会换届工作如期完成,
5745,1998,农业新技术革命与中国农业发展,
5746,1998,学习知识经济  研究知识经济,
5747,1998,原子尺度的亚稳态金刚石膜的生长、形核和异质外延的机理研究,
5748,1998,高举旗帜  开拓创新  迎接世纪之交中国科技事业新发展──在中国科学院1998年度工作会议上的报告,
5749,1998,南沙科考之进展,
5750,1998,具有国际影响的年轻的现代化大学──中国科学技术大学建校四十周年回顾,
5751,1998,周恩来和自然科学──纪念周恩来诞辰一百周年,
5752,1998,中共中央国务院、中国科学院分别集会纪念全国科学大会召开二十周年,
5753,1998,学习理论  认清形势  把知识创新工程试点工作抓实抓好,
5754,1998,社会公益性研究所的改革与调整,
5755,1998,首次获国家科技进步奖的图书──《简明中国科学技术史话》,
5756,1998,略论神经科学的发展,
5757,1998,浅议世界膜科学与技术研究的发展动向——国际膜科学与技术大会的启示,
5758,1998,单原子操纵及相关的物理和化学问题,
5759,1998,关于基础研究的几点思考,
5760,1998,知识分子的楷模──蒋新松,
5761,1998,"江泽民在中国科学院“迎接知识经济时代,建设国家创新体系”研究报告上的批示",
5762,1998,中国科学院鹤山丘陵综合开放试验站,
5763,1998,液态物理学发展概述,
5764,1998,忆邓小平关心科技界二三事──纪念十一届三中全会召开二十周年,
5765,1998,关于保护珍稀古生物化石的紧急呼吁,
5766,1998,中国科学院第九次院士大会 中国工程院第四次院士大会开幕词,
5767,1998,复杂氮陶瓷的相平衡及组份设计,
5768,1998,厄尔尼诺与中国气候异常,
5769,1998,继往开来  不断进取──纪念邓小平关于BEPC建设的重要讲话十周年,
5770,1998,中日宇宙线观测研究成果举世瞩目,
5771,1998,中国科学院第九次院士大会上的工作报告,
5772,1998,“西部之光”计划顺利实施,
5773,1998,北京盘拓咨询有限公司成立,
5774,1998,中国科学院沈阳生态试验站,
5775,1998,应重视前期科技发展战略的研究,
5776,1998,加强跨世纪科技人才的培养,
5777,1998,“中国科学院中日科技交流中心”与“在日中国科技者联盟”在京举行联谊交流会,
5778,1998,生物信息学的发展,
5779,1998,前进中的水土保持研究所,
5780,1998,空间太阳能发电,
5781,1998,草原蝗虫生态学研究,
5782,1998,第一届中美前沿科学研讨会,
5783,1998,中国科学院1997年度国家自然科学奖一等奖及二等奖项目简介,
5784,1998,促进知识创新的科学系统──香山科学会议创办五周年,
5785,1998,中国科学院1997年度“百人计划”招聘工作结束──85位青年学者入选,
5786,1998,建立上海国际航运中心  发展综合交通运输网,
5787,1998,在中国科学院“落实科教兴国战略  实施知识创新工程”会议上的讲话,
5788,1998,功在当代  彪炳千秋──纪念全国科学大会召开二十周年,
5789,1998,有害生物治理的新途径──相生植保学(MPP)的应用前景,
5790,1998,遗传学——为民造福,
5791,1998,应培养大批有创新能力的高层次科技人才,
5792,1998,长江三角洲经济与社会可持续发展若干问题咨询报告,
5793,1998,磁层亚暴面临的难题及研究方向,
5794,1998,高性能计算技术展望,
5795,1998,“按需设岗  按岗聘任”是基础性研究所深化改革的重要措施,
5796,1998,淮河流域中低产田资源优化配置与麦茬水稻旱作,
5797,1998,西双版纳热带植物园与老挝北部地区科技合作成效显著,
5798,1998,科普工作如何面向21世纪,
5799,1998,中国青年学者学术讨论会1998年安排,
5800,1998,黄土高原综合治理科技攻关启示,
5801,1998,我理解的基础研究,
5802,1998,分类定位  务实求进,
5803,1998,新药研究的发展趋势,
5804,1998,大科学研究与国际合作,
5805,1998,1997年个人计算机的产销量我院联想集团在全国居首,
5806,1998,中国科学院阜康荒漠生态系统观测试验站,
5807,1998,对“创新工程”的一点浅见,
5808,1998,1997年逝世的中国科学院院士,
5809,1998,做好留学工作  服务人才战略,
5810,1998,21世纪重要学科领域发展趋势展望,
5811,1998,《科学发展报告》将向社会公开发行,
5812,1998,灵魂与重离子的撞击──记中科院近代物理所研究员詹文龙,
